,artist_name,track_name,release_date,genre,lyrics,len,dating,violence,world/life,night/time,shake the audience,family/gospel,romantic,communication,obscene,music,movement/places,light/visual perceptions,family/spiritual,like/girls,sadness,feelings,danceability,loudness,acousticness,instrumentalness,valence,energy,topic,age
55117,art farmer,fair weather,1958,jazz,sweet dream solve future sweet dream provide past sweet things makeup things things sweet dream conversation sweet dream affection sweet word makeup sweet word things come write letter know better gonna laugh gonna smile gonna sweet dream bear inside sweet dream bear sweet thoughts makeup thoughts thoughts come write letter know better gonna laugh gonna smile gonna sweet dream solve future sweet dream provide past sweet dream solve future sweet dream provide past,73,0.000835422,0.000835422,0.46153746,0.000835422,0.000835422,0.000835422,0.291945301,0.000835422,0.000835422,0.097047398,0.000835422,0.000835422,0.035316532,0.000835422,0.000835422,0.000835422,0.599263511,0.502063944,0.875501883,0.386639676,0.486809563,0.20417935,world/life,0.885714286
55118,sonny clark,cool struttin',1958,jazz,see window hear door felt world convince score watch ries life come go away stay remember tell felt fall apart barely world fight easy believe protect heart stay warm rain water lone night brave dream hold alright hard believe stories tell watch babe sight behold angry cold okay stay ghost garden lock door remind ones come pain hold summer fade autumn time stop move wouldn bother story finish stay stay,70,0.041615175,0.068947083,0.186503106,0.092291883,0.000923361,0.000923361,0.000923361,0.074881285,0.000923361,0.049648092,0.000923361,0.000923361,0.000923361,0.000923361,0.393253728,0.000923361,0.561356006,0.717252519,0.840361286,0.00437247,0.470321517,0.480464255,sadness,0.885714286
55122,sarah vaughan,whatever lola wants (lola gets),1958,jazz,want get little little want mind haveyour mind regretsno regret reline resign heart soul come wantslola want getslola get coat know wincan exception rule irresistible fool heart soul come wantslola want getslola get coat know wincan exception rule irresistible fool,40,0.073580558,0.002105263,0.002105263,0.002105263,0.002105263,0.086685327,0.002105263,0.143324391,0.002105263,0.002105263,0.002105263,0.002105263,0.002105263,0.002105263,0.504752248,0.002105263,0.59818044,0.580904033,0.97590359,0,0.333264633,0.156129801,sadness,0.885714286
55123,sarah vaughan,broken hearted melody,1958,jazz,brooooken hearted meeeelody ooooonce song nooooow taunt wiiiiith memory badada tender ooooh break hearted remind lips long kiss miss go away night play break hearted sing young bright hold tight suddenly heaven bind brooooken hearted ooooonce song nooooow taunt wiiiiiith memory badada tender ooooh break hearted bring sing yearn return break hearted oooooooo oooo oooo oooo ooooooooo oooooooo oooo oooo oooo ooooooooo,62,0.001879699,0.001879699,0.001879699,0.001879699,0.001879699,0.001879699,0.198451145,0.001879699,0.001879699,0.292286763,0.001879699,0.085742674,0.053023626,0.001879699,0.307680002,0.038379699,0.420556699,0.657539164,0.799196586,0,0.748557296,0.54453032,sadness,0.885714286
55126,sarah vaughan,lover man,1958,jazz,know feel long kiss miss lover night cold soul moon lover hear say thrill romance like heavenly dream prayer meet tear whisper sweeet little things ears huggin kissin lord missin lover,31,0.002105263,0.002105263,0.002105263,0.002105263,0.002105263,0.096367807,0.504601693,0.156136108,0.002105263,0.002105264,0.002105263,0.097972271,0.002105263,0.002105264,0.062038701,0.055514997,0.397812195,0.379483629,0.978915641,0,0.083882935,0.0164858,romantic,0.885714286
55130,dean martin,promise her anything,1958,jazz,promise diamonds sparkle like rain promise orchids lot champagne promise star promise promise perfume glamorous furs promise bankbooks promise things dream promise need wealth fame care promise bracelets silver promise servants maid cuddle close like hand glove promise promise bracelets silver promise servants amide cuddle close like hand glove promise promise,51,0.001697793,0.001697793,0.592465622,0.001697793,0.001697793,0.001697793,0.107724848,0.001697793,0.001697793,0.001697793,0.001697793,0.193160906,0.001697793,0.08118173,0.001697793,0.001697793,0.505036283,0.707714791,0.837349234,0,0.744435284,0.395376512,world/life,0.885714286
55132,sarah vaughan,poor butterfly,1958,jazz,story tell little japanese sit demurely neath blossom tree miss butterfly sweet little innocent child till fine young american garden come neath blossom everyday teach american soul easy learn sail away promise return poor butterfly neath blossom wait poor butterfly love moments pass hours hours pass years smile tear murmur moon know faithful sure come come sigh poor butterfly,59,0.057175509,0.001283697,0.351910414,0.03905678,0.001283697,0.141076519,0.125394855,0.001283697,0.001283697,0.001283697,0.001283697,0.128861867,0.090136671,0.001283697,0.052266719,0.001283697,0.242932958,0.491475015,0.983935727,6.63E-05,0.084913438,0.148121543,world/life,0.885714286
55134,judy garland,zing! went the strings of my heart,1958,jazz,dear smile hear haunt start inside start symphony zing go string heart twas like breath spring hear sing nest apart nature perfect zing go string heart eye sky blue repeat recall thrill guess twill depart dear lips rhapsody divine zing go string heart eye sky blue repeat recall thrill guess twill depart dear lips rhapsody divine zing go string zing go string zing go string heart,66,0.001144165,0.001144165,0.001144165,0.001144165,0.001144165,0.001144165,0.176369321,0.001144165,0.001144165,0.379873572,0.001144165,0.001144165,0.001144165,0.05903796,0.266544448,0.102156391,0.459547276,0.628567033,0.903614361,0,0.653751031,0.382363093,music,0.885714286
55140,perry como,when i fall in love,1958,jazz,fall forever fall restless world like end begin moonlight kiss cool warmth heart completely heart moment feel feel fall instrumental bridge heart moment feel feel fall feature film istanbul,29,0.00228833,0.00228833,0.160845429,0.00228833,0.00228833,0.00228833,0.060749169,0.00228833,0.00228833,0.00228833,0.00228833,0.109719763,0.00228833,0.00228833,0.426331598,0.151021122,0.174699448,0.48942389,0.972891539,0.001325911,0.058017312,0.101073027,sadness,0.885714286
55142,dean martin,i know i can't forget,1958,jazz,love wish life darling have love forget forget remember smile laughter laughter remember light shin eye little world right remember things bitter tear touch hand lonely years memories maybe arm soothe sadness love life darling have love forget life darling have love have love forget know forget,47,0.00122399,0.00122399,0.37571332,0.101530021,0.00122399,0.024834014,0.369730204,0.00122399,0.00122399,0.00122399,0.00122399,0.05416724,0.00122399,0.00122399,0.058113328,0.00122399,0.396729124,0.506166192,0.968875471,9.31E-06,0.158079143,0.081753104,world/life,0.885714286
55150,blossom dearie,it amazes me,1958,jazz,height average weight average like estimate average evidently agree consequently amaze simply amaze see dazzle daze learn clip wing soften ways ordinary things unworthy praise praise know worldly wise faze eye amaze worldly wise faze eye amaze,37,0.005263158,0.005263158,0.36750412,0.005263158,0.005263158,0.005263158,0.005263158,0.005263159,0.005263158,0.005263158,0.005263158,0.543022193,0.005263158,0.005263159,0.005263158,0.005263158,0.37398462,0.260159475,0.926706754,1.10E-05,0.126133553,0.042112226,world/life,0.885714286
55152,coleman hawkins,soul blues,1958,jazz,know saxophones talkin bout sound good people know bean hawkins sure swing play pretty sound good sound good hear play body soul please hear record stop right sound like band angels hear sweeter tone fact ttention saxophone hawkins come speak say better listen hear play blue soul wander please long crave doors open try stop like folks start cookin time play melodic fast slow tell hawkins capture tone sound penetrate sure right give thrill come sing like hawkins play sing true sing blue word fan york love hear sing swing sing wing thing country music lovers wiggin singin world know rhythm special swing like horn bear singer cause lyric true funny blue yeah remind years take sing achieve claim fame years ahead time know keep right sing go world make rhythm cause music sure know sing moody sing like forte word write music sing sing sing sing word clever know silence cause masterpiece try sing bean approve mean reminisce surely forget cause hear goodbye,164,0.000407997,0.000407997,0.0410501,0.000407997,0.009171834,0.000407997,0.035055447,0.225722387,0.043187377,0.420885616,0.034895383,0.017452664,0.013322848,0.055470308,0.000407997,0.027578097,0.419473627,0.521165039,0.825301029,0.122469636,0.465169002,0.275252641,music,0.885714286
55159,tony bennett,anything goes,1959,jazz,olden days glimpse stock look shock heaven know go good author know better word letter word write prose go world go today good today night today black white today guy today women prize today silly gigolos great romancer know bind answer propose go world go today good today night today black white today guy today women prize today silly gigolos great romancers know bind answer propose go go go go,70,0.000993049,0.097434876,0.405296958,0.032251531,0.000993049,0.000993049,0.000993049,0.077045958,0.000993049,0.000993049,0.070694412,0.000993049,0.065523402,0.000993049,0.000993049,0.239836278,0.438968916,0.715098839,0.759035903,0,0.788746908,0.5625489,world/life,0.871428571
55161,dean martin,goodnight sweetheart,1959,jazz,goodnight sweetheart meet tomorrow goodnight sweetheart sleep vanish sorrow tear part forlorn bear goodnight sweetheart goodnight sweetheart guide dream enfold hold goodnight sweetheart dream enfold hold goodnight sweetheart goodnight,29,0.004784689,0.004784689,0.29155708,0.100771561,0.004784689,0.004784689,0.317602588,0.004784689,0.004784689,0.004784689,0.004784689,0.004784689,0.109705897,0.004784689,0.113377226,0.004784689,0.214773097,0.321693203,0.926706754,0.102226721,0.069661995,0.055926471,romantic,0.871428571
55164,dean martin,sleep warm,1959,jazz,sleep warm sleep tight turn light sleep tight sleep warm rest head pillow pillow close close night sleep warm sleep dream weave spell sweet dream close eye kiss whisper miss sleep tight sleep sleep warm close eye kiss whisper miss sleep tight sleep sleep warm,45,0.001253133,0.001253133,0.001253133,0.335613265,0.001253133,0.001253133,0.485167016,0.001253133,0.001253133,0.001253133,0.001253133,0.159169593,0.001253133,0.001253133,0.001253133,0.001253133,0.075056861,0.390457144,0.908634446,0.312753036,0.063994229,0.07915042,romantic,0.871428571
55172,count basie,with plenty of money and you,1959,jazz,baby couldn plenty money spite worry money bring little filthy looker buy things place like outside dough root evil strife upheaval certain life plenty money root evil strife upheaval certain life plenty money,33,0.059242068,0.196807006,0.244363042,0.002770083,0.002770083,0.122556408,0.002770083,0.002770083,0.338250312,0.002770083,0.002770083,0.002770083,0.002770083,0.002770083,0.002770083,0.002770083,0.458464204,0.641437838,0.780120261,0.006751012,0.745465787,0.581568513,obscene,0.871428571
55177,art pepper,'round midnight,1959,jazz,work like atlas ashford simpson produce madlib mix hibbert contain sample need gaye courtesy tamla record skeletons tipton newman produce madlib mix cooley contain sample skeletons wonder courtesy motown record contain sample farewell newman courtesy decca record paranoid tipton white produce madlib mix cooley contain sample hook platinum hook courtesy motown record contain sample beat punch courtesy motown record feature madvillain tipton dumile knight produce madlib mix cooley contain sample ring courtesy unidisc record escobar tipton amarante produce madlib mix cooley contain sample tuyo amarante courtesy invada record sandman feature quasimoto tipton rodriguez pepper produce madlib mix cooley contain sample roadgame pepper courtesy galaxy record poison tipton deighton produce madlib mix cooley contain sample freethinker mother earth courtesy acid jazz record contain sample dexterity chamber courtesy jazz record penicillin tipton carmichael gorrell monk hanighen williams produce madlib mix cooley contain sample mind edwards courtesy muse record contain sample round midnight courtesy columbia record fearless picasso sportscentre flintstone rocafella commando bandana bonus track shipments medicate blood money root evil,168,0.001814882,0.112726838,0.001814882,0.001814882,0.001814882,0.001814882,0.001814882,0.001814882,0.541833127,0.194748882,0.001814882,0.052551367,0.072731437,0.001814882,0.001814882,0.001814882,0.423805914,0.572879009,0.976907607,0.705465587,0.14983512,0.143116382,obscene,0.871428571
55178,oscar peterson,it's de-lovely,1959,jazz,night young sky clear want walk dear delightful delicious delovely understand reason sentimental cause delightful delicious delovely tell glance swell night romance hear dear mother nature murmur sweet chickadee kiss delightful delicious delectable delirious dilemma delimit deluxe delovely feel sudden urge sing kind ditty invoke spring control desire curse crucify start tinpantithesis spare pain darn thing sing refrain night young sky clear want walk dear delightful delicious delovely understand reason sentimental cause delightful delicious delovely tell glance swell night romance hear dear mother nature murmur sweet chickadee kiss delightful delicious delovely,91,0.001119821,0.001119821,0.001119821,0.040407182,0.001119821,0.001119821,0.3035608,0.197456715,0.001119821,0.19198964,0.001119821,0.001119821,0.094946307,0.001119821,0.090787394,0.001119821,0.521282357,0.402917724,0.937750942,0.937246964,0.455894477,0.251227866,romantic,0.871428571
55180,art pepper,walkin' shoes,1959,jazz,say shoe feet lookin ugly sock better work woork like tip dip cover chip feet fetish bullshit know sayzzzzzz open toe say dirt diggers wall crawlers meeeeeee idon know clownninng feet need help ruhrawhhhhhh scary movie itselfffff ladies high heel high maintenance wear sandle surround tatoos thats cute carpet clean landlord charge brick muhmoney worldwide feets nail hairstlyist toooooo youtube better learn excuse come crib like greet sensei beauty poppin baby girl dollars okay fee beatz volume freee creme brule money funny fuckin dummy playin papper head head look like fuckin gumby gettin bitch get paper get fuckin money loud smoke damn high comin haters frown catch crowd fuckin bitch blowin paper leave turnt walk ther door blowin comin home blowin aing come home trippy church bitch crazy footwear rugs kosher coshare coshare friends walkin shoe thats shit dont like chillin blunt brew starvin need food motherfckin shoe ayye walk room bitch gotta listen yeah yeah yeah gotta listen bring friends bring bomb weekdnd moan moan better go gotta,169,0.026067812,0.000598086,0.000598086,0.000598086,0.062349761,0.015174251,0.000598086,0.000598086,0.489073268,0.000598086,0.342485012,0.000598086,0.000598086,0.057074776,0.000598086,0.000598086,0.549442218,0.66684614,0.768072056,0.003906883,0.550700742,0.373353802,obscene,0.871428571
55181,bobby darin,where is the one,1959,jazz,search make change dream wake secret door life store journey long longer reckon throng know second bind journey long longer reckon throng know second bind,25,0.002631579,0.002631579,0.463949657,0.148928785,0.002631579,0.002631579,0.002631579,0.124300667,0.002631579,0.002631579,0.223347206,0.002631579,0.002631579,0.002631579,0.002631579,0.002631579,0.179031734,0.345665718,0.872489832,0.071862348,0.06770404,0.092864562,world/life,0.871428571
55182,count basie,life is a song (let's sing it together),1959,jazz,life song sing hearts rhyme learn word learn music hop song last long long time life song go forever refrain wrong strike note mendelssohn write concern spring weather sing life song strike note mendelssohn write concern spring weather sing life song life great song,44,0.001349528,0.001349528,0.34224995,0.001349528,0.001349528,0.001349528,0.001349528,0.001349528,0.001349528,0.634808079,0.001349528,0.001349528,0.001349528,0.001349528,0.001349528,0.001349528,0.453048847,0.570109992,0.912650515,0.002672065,0.496084089,0.264241286,music,0.871428571
55183,dean martin,"goodnight, my love",1959,jazz,goodnight tire moon descend goodnight moment end heavenly hold close heavenly hold dream star promise meet tomorrow dreary present dear sleep tight goodnight remember sweetheart sleep tight goodnight remember sweetheart,30,0.002631579,0.002631579,0.239399143,0.168869832,0.002631579,0.002631579,0.389712037,0.002631579,0.002631579,0.002631579,0.002631579,0.162545304,0.002631579,0.002631579,0.002631579,0.002631579,0.163868732,0.304489398,0.806224705,0.67611336,0.044311624,0.084355788,romantic,0.871428571
55184,dean martin,the things we did last summer,1959,jazz,boat rid moonlight lake dance hum favorite songs things summer remember winter long midway cupie dolls ring prove strong things summer remember winter long early morning hike rent tandem bike lunch pack explain sudden summer rain look leave begin fade like promise right wrong things summer remember winter long remember winter long,52,0.001283697,0.001283697,0.20634608,0.09378953,0.001283697,0.001283697,0.001283697,0.07877284,0.001283697,0.452299702,0.001283697,0.150820089,0.001283697,0.001283697,0.001283697,0.001283697,0.173616376,0.494090198,0.945783078,0.008552632,0.154987634,0.131103994,music,0.871428571
55187,miles davis,swing spring,1959,jazz,sweetness cause york time bring hotel room booker hotel play know try play know time pleasure meet dizzy gillespie remember original band create sound moment hear say music sound tribute birdman father birdland masterpiece release horn word musical greats salute late mentor inventor sound days bebop infuse time jazz rhyme kool daddy bring legends name kick relax jazz soloist play away duty ladies gentlemen mister moody go mile like watch play trumpet pump like mechanic handle tool rebirth cool kind noise string bring make swing sing things musical fling listen bring guitar voice choice like instrument magnificent proud present divine sassy introducin revolution jazz pizazz player usin dizzy gillespie watch busy allow tell story sound sterile woman flexibility range make octaves change ahead thing shoutout zawinul writer birdland fifties place band maitre forget emollient voice marquette ladies gentlemen know special birdland even sound profound come street worldrenowned horn lick kick swift riff stick today bebop make pick musical genius souls clever change face music forever understand past present birdland,169,0.000619195,0.000619195,0.155863163,0.000619195,0.000619195,0.024204488,0.000619195,0.120208618,0.041756765,0.370460675,0.176813523,0.000619195,0.014651514,0.089230109,0.000619195,0.000619195,0.554857576,0.700587134,0.85240949,0.258097166,0.610469909,0.488472513,music,0.871428571
55188,anita o'day,all of you,1959,jazz,kick champagne mere alcohol thrill tell true kick kick cocaine suret take sniff bore terrifically kick kick time stand kick clear obviously kick plane fly high idea kick,28,0.002923977,0.083636772,0.002923977,0.002923977,0.002923977,0.002923977,0.133005688,0.002923977,0.641795578,0.002923977,0.002923977,0.097702312,0.002923977,0.002923977,0.002923977,0.002923977,0.385898408,0.64056611,0.765060005,0,0.88561418,0.365345544,obscene,0.871428571
55193,cal tjader,i love paris,1959,jazz,black current jazz bring gold style little advance blackcurrent jazz album give long keep classic tangible turntables hate simply complicate nice roll dice music say girl confuse prediction rock choose album come fine want young album dope simply outsell like classic heartfelt break blackcurrent jazz come bring black current jazz years later parris stixx roll jazz jazz evans dope certain tjader hancock hines thelonious monk hubbard byrd mingus brubeck plus coltrane hampton name try legacy alive die revive people drop record blackcurrent jazz black current jazz,86,0.001422475,0.336011779,0.001422475,0.001422475,0.001422475,0.027066576,0.001422475,0.001422475,0.001422475,0.143768954,0.178624949,0.001422475,0.090634547,0.118116473,0.001422475,0.001422475,0.594931225,0.475809553,0.858433593,0.875506073,0.686727123,0.498482835,violence,0.871428571
55195,cal tjader,invitation,1959,jazz,gate come know sick touch clue outrap point movement bigger picture try mood yeah candle flicker little licker couple swish try understand mission try soak wisdom miss pollution look start confuse dude brain buzz admit know start punch say point like close point head hitup hand block hell jam judge feel cool understand offend improbable holla verbal assault head shit break neck trust loud get improbable holla verbal assault head shit break neck trust loud get mean meditate basis underrate concern create sit baby mama raise record go play word wordsmith like wordsworth learn curve ahead time rhyme sound like worst worst yeah probmatik flow million flow crew crew expectations miss forgive mood world palm hand beauty land feel like shout shed light introduction rest life like,127,0.01693676,0.263555747,0.095325785,0.000666223,0.026751691,0.029293408,0.000666223,0.11403659,0.36013407,0.000666223,0.000666223,0.027675088,0.000666223,0.000666223,0.000666223,0.059628636,0.657749377,0.367253801,0.948795129,0.711538462,0.38582028,0.133106059,obscene,0.871428571
55198,dean martin,all i do is dream of you,1959,jazz,dream night dream think song sing summer winter autumn spring hours spend sweet content dream away sky sky blue morning noon nighttime dream hours spend sweet content dream away sky sky blue morning noon nighttime dream,36,0.001754386,0.001754386,0.001754386,0.158412759,0.001754386,0.001754386,0.001754386,0.001754386,0.001754386,0.567038797,0.001754386,0.001754386,0.001754386,0.001754386,0.053240943,0.001754386,0.560272934,0.503551009,0.584336932,0.056275304,0.47135202,0.11608851,music,0.871428571
55200,bill evans,some other time,1959,jazz,time go half things want catch time token word unspoken catch time start come time part come embrace time race catch time embrace time race catch time,27,0.00228833,0.107646145,0.00228833,0.376472432,0.00228833,0.00228833,0.00228833,0.08050949,0.00228833,0.00228833,0.358329522,0.00228833,0.00228833,0.00228833,0.00228833,0.00228833,0.377233835,0.356536677,0.994979915,0.92611336,0.066467436,0.014683942,night/time,0.871428571
55201,bill evans,oleo,1959,jazz,chikara young lions title match life apricots pears defeat thief team match stray defeat fist icarus huckabee single match wildebeest wjakob hammermeier defeat missile assault team match colony green defeat creatures deep cajun crawdad merlok infinite gauntlet match ophidian defeat armbreaker amir blank boomer hatfield bull crummels danjerhawk dasher hatfield droese hijo cream enzuigiri fireman fray frantik hallowicked hermit crab cream jawbreaker josue coronado kobald mccoy nytehawk officer barksdale usuper razerhawk shazza mckenzie snapmare solo darling defarge whisper unsocial volgar worker boomer hatfield eliminate danjerhawk dasher hatfield eliminate defarge boomer hatfield eliminate cream boomer hatfield eliminate nytehawk frantik eliminate crummels eliminate dasher hatfield eliminate kobald dasher hatfield eliminate blank dasher hatfield eliminate boomer hatfield armbreaker amir fireman fray snapmare eliminate mccoy coronado eliminate coronado eliminate volgar enzuigiri eliminate bull armbreaker amir enzuigiri fireman fray snapmare eliminate usurper armbreaker amir fireman fray snapmare eliminate hermit crab whisper eliminate coronado shazza mckenzie eliminate jawbreaker josue armbreaker amir enzuigiri fireman fray snapmare eliminate unsocial armbreaker amir enzuigiri fireman fray snapmare eliminate shazza mckenzie razerhawk eliminate droese eliminate fireman fray droese eliminate snapmare armbreaker amir eliminate droese hallowicked eliminate armbreaker amir whisper eliminate hijo cream enzuigiri hallowicked solo darling whisper eliminate,197,0.004385965,0.004385965,0.182324677,0.004385965,0.004385965,0.004385965,0.468047928,0.004385965,0.004385965,0.004385965,0.004385965,0.200153308,0.083684611,0.004385965,0.004385965,0.004385965,0.512617784,0.542137784,0.784136329,0.302631579,0.515663644,0.334313544,romantic,0.871428571
55203,dean martin,white christmas,1959,jazz,christmas white christmas dream white christmas like ones know treetops glisten children listen hear sleigh bell snow dream white christmas christmas card write days bright christmases white dream white christmas christmas card write days bright christmases white,37,0.002105263,0.352337613,0.129477205,0.002105263,0.002105263,0.002105263,0.002105263,0.002105263,0.002105263,0.207736664,0.002105263,0.222067069,0.058907763,0.002105263,0.002105263,0.002105263,0.200693166,0.400225624,0.942771027,0.058198381,0.260098928,0.109081285,violence,0.871428571
55207,bill evans,young and foolish,1959,jazz,young foolish wrong young foolish long soon carefree days sunlit days soon bluebird foolish fell wonder dream smile sunlight laugh rain wish young foolish smile sunlight laugh rain wish young foolish,31,0.002392344,0.002392345,0.107465945,0.002392345,0.002392344,0.002392345,0.002392345,0.002392345,0.002392345,0.246243146,0.002392345,0.002392345,0.190729894,0.002392345,0.312039029,0.002392345,0.40755984,0.307591724,0.976907607,0.563765182,0.115828524,0.017186523,sadness,0.871428571
