,artist_name,track_name,release_date,genre,lyrics,len,dating,violence,world/life,night/time,shake the audience,family/gospel,romantic,communication,obscene,music,movement/places,light/visual perceptions,family/spiritual,like/girls,sadness,feelings,danceability,loudness,acousticness,instrumentalness,valence,energy,topic,age
55644,joe williams,"i'm sticking with you, baby",1964,jazz,bitch bitch fuck bitch fuck yeah time yeah chanel tuck yeah shine bright like truck bitch bitch yeah bitch bitch yeah bitch fuck yeah bitch fuck yeah bitch savage bitch yeah stack cash bitch yeah average bitch yeah blast bitch yeah casket bitch yeah turn baby basket bitch yeah zoovie cash bitch yeah stash spot bitch yeah lie bout trap yeah disrespect clap like happen lack bitch fuck yeah time yeah chanel tuck yeah shine bright like truck bitch bitch yeah bitch bitch yeah bitch fuck yeah bitch fuck bitch grip grain switch lanes switch whip stock clip pocket crip know blue strip bitch yeah nice know treat like thursday bitch throwback police yeah shawty hold damn bitch know bitch like riri tryna fuck time talk talk cheddar diamonds hit hard like mayweather bitch fuck yeah time yeah chanel tuck yeah shine bright like truck bitch bitch yeah bitch bitch yeah bitch fuck yeah bitch fuck bitch fuck yeah time bitch fuck yeah time,164,0.009883433,0.000411184,0.000411184,0.021166738,0.255188682,0.000411184,0.000411184,0.000411184,0.637745237,0.008289841,0.000411184,0.062380674,0.000411184,0.000411184,0.000411184,0.000411184,0.732481317,0.590005897,0.602409239,0,0.730008244,0.344323867,obscene,0.8
55646,dean martin,shutters and boards,1964,jazz,shutter board cover windows house live leave heart sorrow say forgive house build fill laughter change laughter tear live world wish shutter board cover windows night dream come house book shelf open shutter tear board cause drive nail shutter board cover windows time shutter board cover windows shutter board,49,0.001754386,0.164002303,0.309573253,0.001754386,0.001754386,0.001754386,0.001754386,0.001754386,0.001754386,0.001754386,0.292937194,0.001754386,0.001754386,0.001754386,0.207171459,0.001754386,0.420556699,0.544060713,0.962851368,1.79E-06,0.525968673,0.320299092,world/life,0.8
55648,dean martin,we'll sing in the sunshine,1964,jazz,sing laugh everyday sing cost love dear stay year sing laugh everyday sing sing morning kiss night darling cling soon sight sing yeah laugh everyday sing daddy tell kill woman give sing laugh everyday sing year end go away speak sing know laugh everyday sing go away,47,0.001144165,0.038008941,0.212068643,0.001144165,0.024304949,0.026315456,0.130772763,0.001144165,0.001144165,0.502413305,0.001144165,0.001144165,0.001144165,0.001144165,0.052385966,0.001144165,0.398895267,0.603107453,0.822288978,0,0.505358615,0.398379609,music,0.8
55652,thelonious monk,nice work if you can get it (take 3),1964,jazz,check flow know hiphop shit express respect catch life fast death slow feel like wretched crow shoulder turn rebel eye cobra mold pebble boulder hold stop closure grave hear chillin thinkin push woulda shotgun protect posse eye sleep hand like nazi game away yahtzee kamikaze area watch punchlines throw haymakers rap later haters gotta naysayers feel hearts like pacemakers box think outside couple fight knock punch clock yall spit hawk watch follow rule go route role doubt college dropout crew rhyme kinda like jenga takin block truthfully yall need time right google type factz page musically regular work late shouldn place thats earn cake wordplay better half brain yall make yall sick mayne record earthquake drop grind break shit quit straight horrible sound like everybody need tutorials audible vision talkin oracle tell memorial stay right path like write rap people feel recite good nice track doin long hood rappers nowadays sidekick thing look different look game success fame hell yeah question pray dont misunderstand know talent long kid violent melodies thelonious monk echo music hows soundin,176,0.000542594,0.162197767,0.000542594,0.068625805,0.028555353,0.000542594,0.000542594,0.000542594,0.580839886,0.000542594,0.000542594,0.000542594,0.000542594,0.057573155,0.051519894,0.044177016,0.575435936,0.411250417,0.964859402,0.876518219,0.41055235,0.232208253,obscene,0.8
55653,herbie mann,lover man,1964,jazz,hearts pass night lonely night hold tight tight light tomorrow light stay yesterday surround warm precious memory maybe tomorrow build dream life pass night rush night woman night lonely night light tomorrow light maybe tomorrow build dream,37,0.001461988,0.001461988,0.245495578,0.352915309,0.001461988,0.001461988,0.167337767,0.001461988,0.001461988,0.001461988,0.001461988,0.21232152,0.001461988,0.001461988,0.001461988,0.001461988,0.389147623,0.416660257,0.687750691,0,0.254946414,0.109081285,night/time,0.8
55655,mary lou williams,anima christi,1964,jazz,soul sanctification body salvation blood vein water stain passion comfort good listen lord girls voice shout help number time wound hide guard assail life fail come thee saint sing lord lord shouldst enter roof word soul shall cleanse save naughty rise eye prepare feet fool say heart lord,48,0.001644737,0.325917356,0.061593374,0.001644737,0.001644737,0.177689451,0.001644737,0.001644737,0.001644737,0.075514898,0.001644737,0.001644737,0.098644975,0.037232295,0.108726919,0.033510132,0.507202426,0.628567033,0.843373337,0,0.675391591,0.336315609,violence,0.8
55656,nat king cole,i've grown accustomed to her face,1964,jazz,damn damn damn damn grow accustom face make begin grow accustom tune whistle night noon smile frown down second nature like breathe breathe serenely independent content surely grow accustom look accustom voice accustom face infantile idea heartless wicked brainless thing regret regret doom eynsfordhill wretched little flat store till collector beat door teach things teach sell flower instead beg bread water husband breakfast year prematurely grey blossom cheek turn chalk come home up away socialclimbing heiress york poor simply frightful humiliate delightful poignant inevitable night hammer door tear rag miserable lonely repentant contrite hurl wall kindness treatment deserve throw baggage forgive sort position staunchly budge forgive shall crawl knees promise atone shiver moan slam door hellcat freeze hear good morning joy woes highs low second nature like breathe breathe grateful woman easy forget like habit break grow accustom accustom face,140,0.00074129,0.339038529,0.196723214,0.0251774,0.00074129,0.054770771,0.00074129,0.00074129,0.00074129,0.056312258,0.115365286,0.00074129,0.019195327,0.065478514,0.084735021,0.01514131,0.166034875,0.599928211,0.830321115,0,0.187963726,0.305283608,violence,0.8
55657,nat king cole,wouldn't it be loverly,1964,jazz,clock strike guess baby leave somebody play say piano play blue clock strike guess room lonely room improvise memory piano play blue even close duet dusk moon glow go hangin round mind guess kind solo clock strike lord better lock downstairs door play piano play blue guess better lock door come piano play blue piano play blue,57,0.031280786,0.065442578,0.001119821,0.001119821,0.001119821,0.023602569,0.001119821,0.150840269,0.001119821,0.360130585,0.23826829,0.088566357,0.001119821,0.001119821,0.001119821,0.029550536,0.35990469,0.662564418,0.713855134,0,0.304410552,0.366346577,music,0.8
55658,jack jones,she loves me,1964,jazz,give tenderly kiss lover bring bring like long near bright star shine dark know,14,0.003759399,0.003759399,0.003759399,0.003759399,0.003759399,0.003759399,0.398821698,0.003759399,0.003759399,0.003759399,0.003759399,0.537268524,0.003759399,0.003759399,0.003759399,0.003759399,0.429221272,0.597159193,0.440762491,0,0.555853256,0.286263995,romantic,0.8
55660,dean martin,from lover to loser,1964,jazz,lovers losers lovers losers lovers losers lips aren will like hungry embrace goodbye write face fallin heaven know gonna fall kill bind break heart lovers losers clear walk laugh leave tear fallin heaven,33,0.002105263,0.196399189,0.002105263,0.002105263,0.002105263,0.002105263,0.297537576,0.002105263,0.002105263,0.002105264,0.002105263,0.002105263,0.052117383,0.002105263,0.381372786,0.002105263,0.192028593,0.583467938,0.854417525,9.78E-05,0.301319044,0.299277415,sadness,0.8
55665,bobby darin,what a difference a day makes,1964,jazz,difference twentyfour little hour bring flower rain yesterday blue dear today dear lonely nights dear say difference make rainbow sky moment thrill kiss heaven romance menu diference difference difference make rainbow sky moment thrill kiss heaven romance menu difference difference,40,0.001814882,0.001814882,0.075952616,0.001814882,0.001814882,0.041696627,0.547747718,0.001814882,0.001814882,0.187579453,0.001814882,0.121615236,0.001814882,0.001814882,0.001814882,0.001814882,0.241849886,0.05822629,0.977911624,0.003087045,0.077906018,0.004343279,romantic,0.8
55668,duke ellington,a spoonful of sugar,1964,jazz,swing brother swing come swing game swing brother swing stop swing game boys girls shake knees clap hand snap finger sing popeil popeil come swing dance ring look swing clap hand snap finger sing brotherswing swing brother swing come swing game swing brother swing stop swing game,47,0.001283697,0.001283697,0.001283697,0.001283697,0.001283697,0.105804318,0.001283697,0.001283697,0.296751855,0.446893976,0.001283697,0.001283697,0.032609505,0.065111281,0.001283697,0.001283697,0.6187588,0.6771274,0.401605825,0.001133603,0.513602638,0.499483868,music,0.8
55669,mongo santamaria,green onions,1964,jazz,jahi go protecti come hear good brother culture black black reggae know black reggae music message black reggae music message come deliver foundation holy mountains lord loveth zion dwellingplaces black black reggae music know heavens declare firmament sheweth design world night unto night uttereth speech speech language voice hear zion zion black black reggae reggae music know black reggae music message black reggae music message rastaman cause foundation holy mountains lord loveth zion dwellingplaces rasta behold know black black reggae reggae music know black reggae music message mmmmmm black reggae music message somebody jahbible believe say somebody jahbible believe tell say black reggae music tell say black reggae music say ablack ablack black beauty know tadadum black reggae music message hear black reggae music message hear play today know miss black starliners come mean come know black reggae music know arise enemies scatter tomorrow hate flee melteth light desire black reggae music message hear black reggae music message,158,0.000542594,0.2965669,0.038769654,0.000542594,0.000542594,0.034025165,0.000542594,0.188102291,0.000542594,0.350708899,0.000542594,0.03749214,0.000542594,0.000542594,0.000542594,0.047823828,0.702155312,0.663692536,0.336344715,0.938259109,0.897980214,0.647636643,music,0.8
55671,tony bennett,who can i turn to (when nobody needs me),1964,jazz,turn need heart want know destiny lead guide darkness hide maybe tomorrow throw sorrow steal borrow share laughter learn turn turn away learn turn turn away,26,0.00228833,0.00228833,0.240517236,0.00228833,0.00228833,0.00228833,0.00228833,0.00228833,0.00228833,0.00228833,0.00228833,0.207185718,0.00228833,0.00228833,0.469561748,0.00228833,0.18986245,0.606568725,0.930722822,2.04E-05,0.105523495,0.238214447,sadness,0.8
55674,jimmy durante,in the other fellow's yard,1964,jazz,dont believe grass greener fellows dont believe cleaner fellows dont spend time grieve moan youll even moan life away dont believe road bumpy fellows dont believe outlook isnt jumpy isnt hard satisfy look fence youll fellow stand admire satisfy look fence youll fellow stand admire,45,0.002770083,0.002770083,0.732376654,0.002770083,0.002770083,0.002770083,0.002770083,0.002770083,0.002770083,0.002770083,0.220531931,0.002770083,0.002770083,0.002770083,0.002770083,0.002770083,0.296003466,0.593826116,0.782128295,0.000388664,0.394064303,0.250226834,world/life,0.8
55677,earl hines,st. james infirmary blues,1964,jazz,understand baby hand line matter plenty time future baby hand step dance slip hand inside glove hold hold hold hold hold hold want damage go manage hold percentage fool payin dues corner minute spare waitin want hold hold hold hold hold hold,42,0.063088622,0.001503759,0.034597195,0.141832893,0.001503759,0.001503759,0.478891989,0.001503759,0.00150376,0.001503759,0.00150376,0.039464166,0.001503759,0.001503759,0.105223951,0.025534831,0.330661757,0.552060098,0.845381371,0.087955466,0.176628195,0.219194834,romantic,0.8
55678,duke ellington,supercalifragilisticexpialidocious,1964,jazz,strollin watchin winter turn spring walkin dark seein lovers thing ooooooh time feel like makin time feel like makin dream come true baby talk moanin sweet touchin feel start restaurant holdin hand candlelight touchin want strollin watchin winter turn spring walkin dark seein lovers thing ooooooh time feel like makin,50,0.04531909,0.001422475,0.001422475,0.07540834,0.001422475,0.001422475,0.128866308,0.001422475,0.305268582,0.119227676,0.001422475,0.158302902,0.001422475,0.001422475,0.001422475,0.125621674,0.515866999,0.671563726,0.707831032,0.241902834,0.497114592,0.480464255,obscene,0.8
55680,louis armstrong,blueberry hill,1964,jazz,thrill blueberry blueberry moon stand blueberry linger dream come true wind play sweet vow apart thrill blueberry thrill come climb baby blueberry shall blueberry bring horn berry blue moon stand afternoon blueberry higher moon linger weddin dream come true wind play sweet vow remember night apart thrill blueberry,48,0.099883725,0.001594896,0.001594896,0.001594896,0.001594896,0.001594896,0.301817558,0.001594896,0.001594896,0.166825893,0.001594896,0.298106423,0.033739845,0.001594896,0.078892904,0.001594896,0.597097368,0.587083045,0.915662566,5.49E-05,0.392003298,0.200175221,romantic,0.8
55682,stan getz,corcovado (quiet nights of quiet stars),1964,jazz,quiet nights quiet star quiet chord guitar float silence surround quiet thoughts quiet dream quiet walk quiet stream window look mountains lovely want close untill final flicker lifes ember lose lonely believe life bitter tragic joke mean existence,38,0.001949318,0.303801887,0.143960349,0.001949318,0.001949318,0.001949318,0.001949318,0.001949318,0.001949318,0.242119668,0.001949318,0.243841292,0.001949318,0.001949318,0.001949318,0.001949318,0.503953211,0.505858524,0.957831283,0.000251012,0.377576257,0.145118446,violence,0.8
55685,jimmy durante,"smile (from united artists film ""modern times"")",1964,jazz,smile heart achin smile breakin cloud smile fear sorrow smile maybe tomorrow come shinin light face gladness hide sadness tear near time tryin smile cryin life smile light face gladness hide sadness tear near smile fear sorrow smile maybe tomorrow come shinin light face gladness hide sadness tear near time tryin smile cryin life smile smile,56,0.001169591,0.001169591,0.238439192,0.001169591,0.001169591,0.001169591,0.001169591,0.001169591,0.051576492,0.001169591,0.001169591,0.194461018,0.001169591,0.001169591,0.497979437,0.001169591,0.384815336,0.605312412,0.817268893,0,0.342539159,0.384365157,sadness,0.8
55686,jimmy durante,try a little tenderness,1964,jazz,hustle today incline miss little things mean word smile kiss woman love hero eye hero realize weary women weay wear shabby dress weary little tenderness know wait anticipate things possess little tenderness sentimental grief care word soft gentle make easier regret women forget happiness easy little tenderness regret women forget happiness easy little tenderness,54,0.001422475,0.001422475,0.379498625,0.001422475,0.001422475,0.161974555,0.180758654,0.135058319,0.001422475,0.001422475,0.122795195,0.001422475,0.001422475,0.001422475,0.001422475,0.001422475,0.341492473,0.534958849,0.663654281,0.000753036,0.43940643,0.238214447,world/life,0.8
55687,oscar peterson trio,girl from ipanema,1964,jazz,remedy confusion thrust silence seclusion bring night pull guide pain count nocturnal hours drown visions haunt sleep faint flicker power leak pull guide failure inside test persist keep enigma criteria demand deadly pattern wreath prosperous ways pale ghost corner pour caress shoulder puzzle shrewd innocence run tide beneath usher inner grave nail bleed struggle weak heart lullaby ones lose reel inside gleam necklace reflect stare primal regret turn walk away spiral grind like autumn leave leave fade away wake sound lapse ways misery,83,0.00122399,0.480025719,0.083724041,0.034687372,0.00122399,0.00122399,0.00122399,0.00122399,0.00122399,0.00122399,0.00122399,0.00122399,0.00122399,0.00122399,0.383203015,0.00122399,0.498537853,0.456887932,0.858433593,0.936234818,0.652720528,0.263240253,violence,0.8
55692,oscar peterson trio,quiet nights of quiet stars (corcovado),1964,jazz,jewel jewel drug lose dream black messiah rashad cilvia demo kairon irse ujubasajuba jenkins water cunninlynguists strange journey volume narcissus drown busdriver perfect hair gibbs madlib pinata innercity ensemble pink moon jellyfish brigade dive lessons blue pills blue pills cyhi prynce black hystori project schoolboy oxymoron hawkhouse handshake brain jucara encarnado open eagle dark comedy smoke daye hello world aphex twin syro riff raff neon icon,66,0.002770083,0.331666992,0.002770083,0.002770083,0.002770083,0.002770083,0.002770083,0.002770083,0.002770083,0.109147485,0.002770083,0.261939169,0.110846574,0.097383682,0.002770083,0.002770083,0.583017437,0.438940594,0.791164449,0.863360324,0.412613355,0.335314576,violence,0.8
55696,louis armstrong,"it's been a long, long time",1964,jazz,kiss kiss twice kiss long long time felt like dear remember long long time know dream dream kiss kiss twice kiss long long time kiss kiss twice kiss long long time felt like dear remember long mighty long time know dream dream kiss kiss twice kiss long long time mighty mighty long time,53,0.000974659,0.000974659,0.000974659,0.448250971,0.000974659,0.000974659,0.424705019,0.000974659,0.000974659,0.000974659,0.000974659,0.000974659,0.056533161,0.055890966,0.000974659,0.000974659,0.620924943,0.648027075,0.775100176,0,0.648598516,0.379359996,night/time,0.8
55698,the modern jazz quartet,bachianas brasileiras,1964,jazz,naah yaay nayi riddim burnin marijuana corna calma smarta burnin highway highest grade gettin head marijuana corna calma smarta burnin highway highest grade gettin head time steal bredren sistren babylon like chop heap distroy stick lock crime healin nation neva healin nation waahi marijuana corna calma smarta burnin highway highest grade gettin head marijuana corna calma smarta burnin highway highest grade gettin head dont tink jokin smokin tell frend catch like tokin rasta smoke thats real ting thats bring song sing yeaaaa marijuana corna calma smarta burnin highway highest grade gettin head marijuana corna calma smarta burnin highway highest grade gettin head time steal bredren sistren babylon like chop heap distroy stick lock crime healin nation neva healin nation waahi marijuana corna calma smarta burnin highway highest grade gettin head marijuana corna calma smarta burnin highway highest grade gettin head marijuana corna calma smarta burnin highway highest grade gettin head,150,0.001144165,0.042293995,0.001144165,0.001144165,0.001144165,0.001144165,0.001144165,0.001144165,0.463619259,0.054821485,0.422102789,0.001144165,0.001144165,0.001144165,0.001144165,0.001144165,0.472544135,0.275773658,0.949799146,0.760121457,0.170445177,0.06023091,obscene,0.8
55701,louis armstrong,a kiss to build a dream on,1964,jazz,kiss build dream imagination thrive kiss sweetheart kiss build dream kiss leave imagination fee hungry heart leave thing kiss build dream fancy weave romance make believe true lips moment imagination moment live kiss build dream fancy weave romance make believe true lips moment imagination moment live kiss build dream,49,0.001315789,0.00131579,0.421374423,0.001315789,0.001315789,0.001315789,0.481157366,0.00131579,0.001315789,0.001315789,0.00131579,0.00131579,0.076415579,0.00131579,0.00131579,0.001315789,0.568937507,0.653052329,0.853413507,0.000648785,0.406430338,0.27925677,romantic,0.8
55705,nat king cole,i don't want to see tomorrow,1964,jazz,waynemorris want tomorrow tomorrow lovely bright suddenly break want tomorrow tomorrow hear cloud disappear door happiness open wide want tomorrow want walk want dream want close heart go face sunday monday face darling bright tomorrow young want face tomorrow tomorrow hear cloud disappear door happiness open wide want tomorrow,49,0.001119821,0.001119821,0.319138424,0.001119821,0.001119821,0.001119821,0.043515147,0.001119821,0.001119821,0.043308986,0.048042802,0.191335175,0.001119821,0.001119821,0.167985716,0.001119821,0.310083397,0.513088737,0.806224705,0,0.372423743,0.210185543,world/life,0.8
55707,louis armstrong,you are woman i am man,1964,jazz,woman smaller taller softer touch feel like feel admire friendship leave desire explanation woman woman kiss explanation woman woman kiss,20,0.003759399,0.003759399,0.003759399,0.003759399,0.003759398,0.003759399,0.664277944,0.003759399,0.003759399,0.003759399,0.003759399,0.003759399,0.003759398,0.075253647,0.058439785,0.145637645,0.607928084,0.669948466,0.747991715,0,0.64653751,0.398379609,romantic,0.8
55709,john coltrane,satellite,1964,jazz,alabama shakessound color prhyme scottrodeo watch throne givensfly exam anderson paakmalibu leerise kaytranada pusha tdarkest beautiful eulogysatellite kite defthe ecstatic soul feet high rise foreign exchangeleave childish gambinobecause internet walethe gift mali musicmali gibbspiñata cubeamerikka want keysthe diary drakenothing lupe fiascotetsuo youth alert upside eternal sufjan stevensage jewel cudiman moon mcartneyband madvillainy marleyexodus solangea seat table radioheadok rakimpaid pharcydebizarre ride waynetha mobb deepthe infamous clipsehell hath fury gzaliquid swords ghostface killah raekwon snoop doggdoggystyle ellington coltrane glasperblack radio coleforest hill drive swoopewake lupe fiascothe cool scarfacethe fugeesthe score notorious biglife death tribe call questlow theory youngharvest scottwho hammondthe page life kritreturn rootsthings fall apart dmxit dark hell ugkridin dirty legendget lift black starmos talib kweli coldplaya rush blood head lecraechurch clothe zthe black album kanye westmbdtf defblack side public enemyit take nation commonbe pacme world zreasonable doubt tang clan chamber angeloblack messiah heronpieces earth wind fireall mayfieldcurtis hathawaydh collection coltranea supreme franklinlady soul lamargood maad city kanye westlate registration kriteva nerdin search erykah badubaduizm erykah badumama outkastaquemini nasillmatic jacksonoff wall dilladonuts lupe fiascofood liquor pink floyddark moon jimi hendrixelectric ladyland wondersongs life jacksonthriller kanye westcollege dropout lamartpab gayewhat go,189,0.00122399,0.31653666,0.077634882,0.00122399,0.00122399,0.00122399,0.00122399,0.00122399,0.00122399,0.00122399,0.221573845,0.226776122,0.00122399,0.028159411,0.03677736,0.00122399,0.445467345,0.5801605,0.550200352,0.000135628,0.345630668,0.42540748,violence,0.8
55710,nat king cole,you're my everything,1964,jazz,underneath roll dream real reality idea perfect personality need song sing book read belief brief winter summer spring need song sing book read belief brief winter summer spring,28,0.002392345,0.002392345,0.002392345,0.002392344,0.093301435,0.002392344,0.002392345,0.002392345,0.002392345,0.647296159,0.002392345,0.076312393,0.002392345,0.056135938,0.002392345,0.046621671,0.299252681,0.509576186,0.744979664,0,0.227122836,0.207182447,music,0.8
55711,louis armstrong,be my life's companion,1964,jazz,life companion grow grow livin grow stay young cause grow people lonely thirtythree happen happen life companion grow grow grow youth happiness hold life companion grow know lonely thirtythree want thirtythree disposition sour like lemon tree happen happen life companion grow grow youth happiness hold life companion grow life companion grow grow youth happiness hold life companion grow,58,0.00122399,0.00122399,0.766975369,0.00122399,0.00122399,0.00122399,0.074258332,0.00122399,0.00122399,0.00122399,0.00122399,0.00122399,0.066426107,0.00122399,0.048458815,0.00122399,0.395646052,0.693510756,0.865461712,2.33E-06,0.765045342,0.519504513,world/life,0.8
55714,jimmy durante,the time is now,1964,jazz,songs hear know know songs songs start playin songs hear awhile come fashion go style songs think forget songs songs recall ride spring time walk fall country night come rain come even part morning life forget reason simple memory belong wonderful songs songs easy hear listen play hum veranda strum guitars remember later recall sing year start smile shed tear life time belong wonderful songs wonderful songs wonderful songs,69,0.00093985,0.00093985,0.18417337,0.00093985,0.00093985,0.00093985,0.00093985,0.00093985,0.00093985,0.573093915,0.124051997,0.00093985,0.00093985,0.00093985,0.104582973,0.00093985,0.389147623,0.618413968,0.827309064,1.13E-05,0.409521847,0.31028877,music,0.8
55715,dean martin,the door is still open to my heart,1964,jazz,door open heart confess loneliness door open heart like door open heart ashamed better hold inside satisfy close door open heart ashamed better hold inside satisfy close door open heart door open heart,33,0.001754386,0.001754386,0.001754386,0.001754386,0.001754386,0.001754386,0.156232519,0.001754386,0.086634582,0.001754386,0.001754386,0.001754386,0.001754386,0.001754386,0.729062723,0.001754386,0.40755984,0.566828193,0.681726588,0.0001417,0.3930338,0.435417803,sadness,0.8
