,artist_name,track_name,release_date,genre,lyrics,len,dating,violence,world/life,night/time,shake the audience,family/gospel,romantic,communication,obscene,music,movement/places,light/visual perceptions,family/spiritual,like/girls,sadness,feelings,danceability,loudness,acousticness,instrumentalness,valence,energy,topic,age
54304,gene ammons,it's the talk of the town,1950,jazz,lovers sweethearts hard understand know happen know start strangers plan face anyplace people stop stare hard everybody know leave talk time meet heart skip beat stop speak week everybody know leave talk send invitations friends relations announce weddin friends relations give congratulations face sweetheart stay apart foolish pride like end talk face sweetheart stay apart foolish pride like end talk talk,61,0.001096491,0.001096491,0.001096491,0.001096491,0.03631599,0.001096491,0.001096491,0.460773169,0.086498293,0.001096491,0.001096491,0.001096491,0.04170651,0.001096491,0.319570493,0.001096491,0.352323189,0.620388175,0.868473764,0.23582996,0.430131904,0.282259866,sadness,1
54305,gene ammons,you go to my head,1950,jazz,head linger like haunt refrain spin round brain like bubble glass champagne head like sparkle burgundy brew mention like kicker julep thrill think think plea cast spell hold head smile make temperature rise like summer thousand july intoxicate soul eye certain heart hasn ghost crazy romance head head,48,0.001754386,0.340963946,0.001754386,0.001754386,0.001754386,0.001754386,0.131871772,0.001754386,0.001754386,0.001754386,0.001754386,0.172401985,0.001754386,0.328446507,0.001754386,0.001754386,0.379399978,0.638540625,0.907630429,0.900809717,0.221970322,0.184158704,violence,1
54307,bud powell,yesterdays,1950,jazz,music speak start hear musicians like dizzy gillespie recommend somebody music study hungrier hungrier sound electronic instrument keyboard instrument electronic pianos particularly like fender roads electric piano electric clavinet like electric clavicord string little rubber hammer string press like think sort guitar like clavinet sound wahwah thing go kinds things signal source alter sound wahwah peddle wahwah sound clavinet keyboard instrument truly keyboard instrument small synthesizer universe sound representative trillion sound grind zero preconceive ideas go play rhythmically melodically harmonically know go emerge moment moment real leader kind music focus shift music come right center room vehicles direction begin somepoint emerge explosion kind walk jazz time like,107,0.001144165,0.001144165,0.074762037,0.04617253,0.001144165,0.018788672,0.001144165,0.001654752,0.001144165,0.421733687,0.096266452,0.001144165,0.001144165,0.230954443,0.001144165,0.097081614,0.489873281,0.467399944,0.99297188,0.927125506,0.334295136,0.228204124,music,1
54311,tony bennett,stranger in paradise,1950,jazz,hand stranger paradise lose wonderland stranger paradise stand starry eye danger paradise mortals stand like face ascend common place rarest space hang suspend know care answer fervent prayer stranger paradise send dark despair hunger open arm stranger paradise tell need stranger,41,0.002105263,0.180523864,0.002105263,0.002105263,0.002105263,0.002105263,0.002105263,0.201965101,0.002105263,0.002105263,0.002105263,0.002105263,0.058502691,0.002105263,0.527429395,0.002105263,0.179031734,0.559469784,0.983935727,0.001781377,0.086974444,0.23521135,sadness,1
54313,dean martin,zing-a zing-a zing boom,1950,jazz,zinga zinga zinga zinga zinga zinga zinga zingboom zinga zinga zinga zinga zing boom funny keep sing zinga zinga zinga zinga zing boom memory keep ring zinga zinga zinga zinga zing boom work charm hearts cling start dance ticket romance music play dancers sway cabellero feel cupid arrow dance true heart zinga zinga boom zinga zinga zinga zinga zing boom escape music get zinga zinga zinga zinga zing boom forget let zinga zinga zinga zinga zing boom worry upset thing away blue zinga zinga zinga zinga zing boom music play dancers sway zinga zinga boom cabellero feel cupid arrow zinga zinga boom dance true zinga zinga boom heart zinga zinga boom zinga zinga boom zinga zinga zinga zinga zing boom zinga zinga zinga zinga zing boom escape music get zinga zinga zinga zinga zing boom forget let zinga zinga zinga zinga zing boom worry upset thing away blue zinga zinga boom zinga zinga boom zinga zingaboom zinga zinga boom boom,160,0.001253133,0.001253133,0.001253133,0.001253133,0.001253133,0.081125966,0.001253133,0.111950891,0.001253133,0.268737179,0.001253133,0.094921143,0.001253133,0.001253133,0.42572096,0.001253133,0.580851294,0.687408661,0.655622144,0,0.936108821,0.418400254,sadness,1
54315,dean martin,be honest with me,1950,jazz,honest dear remember dear true wander land honest poor heart break dear untrue asleep awake dear dream darling honest return dear kinda yearn dear forget dear sweet memory honest,29,0.002392344,0.002392345,0.002392345,0.002392345,0.002392345,0.002392345,0.577802883,0.002392345,0.002392345,0.002392345,0.002392345,0.002392345,0.117758779,0.047883064,0.220670106,0.002392344,0.555940648,0.635079353,0.887550088,0,0.924773289,0.322301157,romantic,1
54319,dean martin,three wishes,1950,jazz,wish simple wish wish wish days gladness sweet true second wish dream house cozy fireside wish wish wish days gladness sweet true second wish dream house cozy fireside wish,29,0.002192982,0.002192983,0.274581615,0.002192983,0.002192982,0.002192982,0.153703547,0.002192983,0.002192983,0.002192983,0.104936602,0.002192982,0.002192982,0.002192983,0.4338835,0.002192982,0.281923535,0.492269825,0.989959829,0.00027834,0.134377576,0.056927504,sadness,1
54321,dean martin,just for fun,1950,jazz,softly sigh close maybe agree hand magic land seek constantly tingle tingle mingle pretend begin play stay try tingle tingle mingle pretend begin play stay try,26,0.003095975,0.003095975,0.003095975,0.003095975,0.003095975,0.003095975,0.003095976,0.074609194,0.003095975,0.003095976,0.003095975,0.208936861,0.070528041,0.003095975,0.599486274,0.003095975,0.307917253,0.468271671,0.964859402,0.00045749,0.266281946,0.109081285,sadness,1
54324,dean martin,absence makes the heart grow fonder (for somebody else),1950,jazz,leave know grieve remember absence make heart grow fonder somebody dearly sincerely remember absence make heart grow fonder somebody away mice play blue away fretful forgetful remember absence make heart grow fonder somebody away mice play blue away fretful forgetful remember absence make heart grow fonder somebody somebody,48,0.001644737,0.001644737,0.294424965,0.001644737,0.001644737,0.001644737,0.001644737,0.001644737,0.001644737,0.148253216,0.001644737,0.001644737,0.001644737,0.001644737,0.350568879,0.182081887,0.177948662,0.537856062,0.936746924,0.255060729,0.168384171,0.122094704,sadness,1
54329,dean martin,"vieni su (say you love me, too)",1950,jazz,vieni vieni vieni come years long wait vieni vieni long wait vieni vieni,13,0.114679394,0.007518797,0.170186454,0.594833399,0.007518797,0.007518797,0.007518797,0.007518797,0.007518797,0.007518797,0.007518797,0.007518797,0.007518797,0.007518797,0.007518797,0.007518797,0.224520741,0.400225624,0.976907607,0.610323887,0.180750206,0.040710781,night/time,1
54330,dean martin,the money song,1950,jazz,need need shame funny funny funny money need stick like glue funny funny funny money confess money happiness poor doubt miserable spend wiser save miser want cuckoo funny funny funny money money shut sing sing like like want sing sing sure right need badly folks gladly need nut funny funny funny money frighten internal revenoooooooo funny funny funny money bird sing eat wind wing ideal live folks affirm suppose woman thing germs sanitary thank funny funny funny money mumble jumble need need need need want shame funny funny funny money need need stick like glue funny funny funny money money money funny funny funny,104,0.000619195,0.000619195,0.042723323,0.000619195,0.111143947,0.031532024,0.000619195,0.148335183,0.51008509,0.104985306,0.000619195,0.01460941,0.000619195,0.000619195,0.000619195,0.000619195,0.682660024,0.619619004,0.945783078,0,0.723825227,0.250226834,obscene,1
54332,dean martin,i don't care if the sun don't shine,1950,jazz,label vitamin like vitamin alright like vitamin vitamin doggone care shine lovin even time baby go go meet baby kiss kiss kiss kiss time kiss time like keep score care shine lovin even time baby kiss kiss kiss kiss time kiss time like keep score care shine lovin even time baby,51,0.166018568,0.001196172,0.001196172,0.198032993,0.001196172,0.001196172,0.318618876,0.001196172,0.001196172,0.001196172,0.001196172,0.124300144,0.001196172,0.12303746,0.001196172,0.05444172,0.644752518,0.647104069,0.930722822,0.000334008,0.808326463,0.315293931,romantic,1
54336,erroll garner,i don't know why (i just do),1950,jazz,weep maverick nigga inadequate girl spend money teach better bitch woman excuse mouth foul lately champion live life toast good fuck negative guess competitive life true lesson damn bunch fake solitary spend time perish expect leverage believe evolution heaven fall catch lord open grate right sale soul bruh quickest situation change wrong route children today guidance leave supper fee knowledge ways want see niggas gossip body success appreciate iching real shit real discussion want resurrection judgment funny niggas change little money work know bless lord guide devil yeah scream need help flesh paris mind right fuck money soul hoe good swear haters want plot dare early worm catch grow shit nigga adolescence stand tall game jermone bettis basic kill shit need medic niggas want high jumpers knee feel like hundreds count grow pedestal capture moment go yeah typical fuck niggas cause mission bigger hurt know ones dirt ball shuttleworth take nigga drop come bench starter hood niggas play key erroll garner,161,0.000521105,0.08334572,0.200467172,0.000521105,0.035437917,0.068051597,0.000521105,0.000521105,0.455137859,0.000521105,0.000521105,0.000521105,0.020634245,0.012646843,0.023198852,0.055954722,0.514783927,0.298361664,0.995983932,0.876518219,0.165292663,0.048919246,obscene,1
54340,george shearing,i'll remember april,1950,jazz,shear quintet lovely lengthen even sigh goodbye walk remember content love lips warm spring afraid autumn sorrow remember dwindle glow ash flame live little forget lonely remember smile,28,0.002392345,0.002392345,0.271447849,0.002392345,0.002392345,0.048427252,0.322101042,0.002392345,0.002392344,0.06904882,0.002392345,0.138348464,0.002392345,0.002392345,0.119526094,0.002392345,0.613343442,0.326538984,0.991967863,0.906882591,0.598103875,0.114086446,romantic,1
54342,doris day,here in my arms,1950,jazz,arm adorable deplorable lips kissable permissible share heart lonely hold arm adorable deplorable arm adorable kissable permissible share heart lonely hold arm adorable adorable deplorable,25,0.003759398,0.003759398,0.003759399,0.003759399,0.003759398,0.003759398,0.932330826,0.003759399,0.003759398,0.003759399,0.003759398,0.003759399,0.003759398,0.003759398,0.003759399,0.003759398,0.250514459,0.543778684,0.915662566,0,0.170445177,0.17314735,romantic,1
54344,vic damone,an affair to remember,1950,jazz,affair wondrous thing rejoice remember bear embrace tear time space affair flame burn eternity hand fervent prayer live share affair remember hand fervent prayer live share affair remember,28,0.003095975,0.003095975,0.678303856,0.003095975,0.003095975,0.003095975,0.003095976,0.003095975,0.003095975,0.003095975,0.003095975,0.190816993,0.081343546,0.003095975,0.003095976,0.003095975,0.262428247,0.632489808,0.884538037,1.67E-05,0.234336356,0.366346577,world/life,1
54345,george shearing,conception,1950,jazz,drink miserable miracle sink belly cherryfalls bouncin wall live dead night constant fight socialite tide darken room look gloom leave soon scar find scar grow know mean burst seam souled fuel ears leave fear know live fast smoke joke unrestrained come gonna feel pain piss drain week tire campaign interchangeable see see like trouble trouble free scar find scar grow know mean burst seam souled fuel ears leave fear know live fast scar find scar grow know mean burst seam souled fuel ears leave fear know live fast,88,0.00093985,0.330006324,0.142438803,0.00093985,0.00093985,0.00093985,0.00093985,0.258970612,0.00093985,0.00093985,0.184539356,0.00093985,0.052788365,0.00093985,0.00093985,0.00093985,0.597097368,0.355562393,0.984939744,0.925101215,0.612530915,0.166140124,violence,1
54346,george shearing,september in the rain,1950,jazz,leave come tumble remember september rain go like die september rain word hear whisper raindrops play sweet refrain spring september september rain word hear whisper raindrops play sweet refrain spring september september rain september bring pain september rain,38,0.002024292,0.002024292,0.002024292,0.002024292,0.002024291,0.002024292,0.002024292,0.002024292,0.002024292,0.716694177,0.002024292,0.002024292,0.002024292,0.002024292,0.073479107,0.002024292,0.528863858,0.313463067,0.929718805,0.726720648,0.590890354,0.142115349,music,1
54347,george shearing,pick yourself up,1950,jazz,pick deep breath dust start impossible chin grind pick dust start lose confidence slip grateful pleasant pick dust start work like soul inspire battle sick tire remember famous fall rise pick dust start work like soul inspire till battle sick tire remember famous fall rise deep breath pick dust start,50,0.001315789,0.448888515,0.00131579,0.00131579,0.001315789,0.043817512,0.00131579,0.00131579,0.00131579,0.00131579,0.20227601,0.00131579,0.001315789,0.00131579,0.285281121,0.001315789,0.614426514,0.324154552,0.983935727,0.928137652,0.710428689,0.156129801,violence,1
54348,doris day,oh me! oh my! oh you!,1950,jazz,care forever end world splendid care dear true lips eye blue handsome sweet simply lift feet,16,0.003759399,0.003759399,0.249177676,0.003759399,0.003759398,0.003759399,0.375627869,0.003759399,0.003759399,0.083301157,0.003759399,0.235502317,0.003759399,0.003759399,0.003759399,0.003759399,0.767139608,0.481527062,0.626505649,0,0.654781533,0.15112464,romantic,1
54349,doris day,i know that you know,1950,jazz,know know choose lose wish know long hold arm time time twill soon goodbye time starlight hold tight little kiss nightynight know know choose lose wish know long hold arm time time twill soon goodbye time starlight hold tight little kiss nightynight,42,0.001422475,0.001422475,0.001422475,0.28561236,0.001422475,0.057105484,0.342176221,0.257187301,0.001422475,0.001422475,0.001422475,0.001422475,0.001422475,0.001422475,0.001422475,0.001422475,0.65991552,0.487680435,0.875501883,1.75E-06,0.635201979,0.320299092,romantic,1
54351,dean martin,muskrat ramble,1950,jazz,look shuffle shuffle ramble scramble head hustle bustle buzz happily wait station look train number sevenonine huff puff arrive time think arrive band dixieland gonna play muskrat ramble tune hear play ready parade come join throng feel beat ramble scramble muskrat song come ramble look shuffle shuffle look band parade look happiness go everybody celebrate look drummer entertain gang cling clang bang change dead alive band dixieland gonna hear play dixieland better reservation plan person night stand come folks come join throng feel beat shuffle scuffle muskrat song come ramble,90,0.061140015,0.096754423,0.083148215,0.088665404,0.022474451,0.001119821,0.001119821,0.001119821,0.001119821,0.315341387,0.001119821,0.001119821,0.001119821,0.162875512,0.001119821,0.048613422,0.562439077,0.622388021,0.944779061,0.004716599,0.854699093,0.260237157,music,1
54352,dean martin,that certain party,1950,jazz,naughty eye naughty eye certain certain party know mean certain party naughty eye turn nose cheek pretty clothe smarty love ways sure love ways certain party remember time vaudeville sure joke like stand head high better sing know know certain certain party forget forget certain party know forget smarty certain party babble hold hold sing shorthand speed better babble wiener schnitzel certain certain party babble hasenpfeffer certain party know forget smarty certain party certain party certain party,77,0.001119821,0.001119821,0.11175998,0.001119821,0.001119821,0.001119821,0.117124938,0.218199334,0.408801223,0.048070418,0.001119821,0.042041987,0.001119821,0.04056427,0.001119821,0.001119821,0.535362287,0.629028536,0.875501883,0,0.645507007,0.203178317,obscene,1
54356,dizzy gillespie,"love me, pretty baby",1951,jazz,bring pretty roses bottle wine table ready baby dine buy candle stick candlelight glow write little note tell wish know baby hasn come quarter blue bluest blue bluest bluest blue blue blue bluest blue blue have date come minutes late greet kiss sigh sweet kiss goodbye wonder tire imagination have spree blue bluest blue bluest bluest blue blue blue bluest blue blue leak drip sink suddenly radio go blink fall apart rain rain heart like loon watch moon sit hop wait baby come soon,84,0.095929605,0.000862813,0.000862813,0.063689704,0.000862813,0.000862813,0.080824431,0.000862813,0.000862813,0.416261427,0.18041613,0.076817716,0.000862813,0.000862813,0.075707234,0.000862813,0.330661757,0.563905341,0.974899573,0.515182186,0.301319044,0.097269104,music,0.985714286
54357,gerry mulligan,mulligan's too,1951,jazz,come bout quarter bring bring bring brothers bring sing song like jeru lovely people road sing song jeruvian mode pref rence rence write song like jeru kind tell write extend bridge romance haunt reverie come bout quarter come early late invite delight sing little song like jeru gather tale tell maybe maybe listen friend blowin away doin alright plain workin night listen movin coverin grind singin song lovin sound listen blow bird feather playin blue rhythm moment come warn cool tell story payin dues assist unexpected borning twas birth cool tell try tell listen come york reverie come bout quarter forget versify better start try write song jeru,108,0.065527181,0.000711238,0.000711238,0.000711238,0.000711238,0.013353179,0.037213054,0.185872695,0.117089022,0.416483116,0.051275974,0.000711238,0.019615276,0.040066165,0.000711238,0.000711238,0.456298061,0.532087275,0.538152147,0.000742915,0.677452597,0.377357931,music,0.985714286
54359,dean martin,i ran all the way home,1951,jazz,home tell sorry mean mean home hold arm dear want near cause moment close door hear know act blindly couldn good home hold arm dear want near cause moment close door hear know act blindly couldn good home forgive want,40,0.001422475,0.001422475,0.001422475,0.001422475,0.001422475,0.001422475,0.319557423,0.356647292,0.001422475,0.162960554,0.001422475,0.001422475,0.001422475,0.001422475,0.001422475,0.056775546,0.5234485,0.56582827,0.93473889,3.10E-06,0.433223413,0.090762394,romantic,0.985714286
54361,doris day,christmas story,1951,jazz,come little children come christmas tree windows christmas snow mistletoe christmas hear church bell ring hear choir sing silent night float holy night bring peace heart message come peace earth christmas christmas tree windows christmas snow mistletoe heart message come peace earth christmas christmas,44,0.075250786,0.001814882,0.001814882,0.001814882,0.001814882,0.039535367,0.001814882,0.001814882,0.001814882,0.310527843,0.001814882,0.116973571,0.361925993,0.001814882,0.072192973,0.001814882,0.198527023,0.516908956,0.984939744,2.73E-05,0.195177246,0.188162834,music,0.985714286
54362,doris day,you're getting to be a habit with me,1951,jazz,kiss like drug get habit stay arm addict charm get habit think leave couldn supply need break away everyday regularly coffee clutch break free get habit,26,0.003095975,0.003095975,0.003095976,0.003095975,0.003095976,0.003095975,0.106851705,0.28259645,0.003095975,0.003095975,0.003095975,0.003095975,0.062592308,0.069744254,0.434871629,0.003095975,0.568937507,0.452375458,0.9588353,1.21E-06,0.269373454,0.032402213,sadness,0.985714286
54365,bing crosby,santa claus is comin' to town,1951,jazz,better watch better better pout tell santa comin make list check twice gonna naughty nice santa comin see sleep know awake know good good goodness sake better watch better better pout tell santa comin santa comin santa comin santa comin santa comin better watch better better pout tell santa comin make list check twice gonna naughty nice santa comin see sleep know awake know good good goodness sake better watch better better pout tell santa comin santa comin santa comin santa comin santa comin santa comin santa comin santa comin santa comin santa comin,94,0.000822368,0.000822368,0.000822368,0.057997222,0.000822368,0.000822368,0.000822368,0.09562248,0.748351664,0.000822368,0.000822368,0.000822368,0.000822368,0.000822368,0.000822368,0.051362973,0.54402686,0.6657693,0.810240773,0,0.95362737,0.424406448,obscene,0.985714286
54366,dean martin,sailors' polka,1951,jazz,come play sailors polka navy blue girls polka sailor try true music moonlight navy know come play sailors polka navy blue band start aplaying fleet come sail hooraying good time begin gobs gobs miss wait shore gobs gobs kiss gobs long drop anchor hear music start pretty girl hanker sailor heart yeah band start aplaying dance begin fleet come sail come play sailors polka navy blue girls polka sailor try true music moonlight navy know come play sailors polka navy blue,81,0.081727929,0.001031992,0.001031992,0.034752332,0.021265126,0.001031992,0.047602454,0.084740971,0.001031992,0.36469324,0.001031992,0.19381157,0.001031992,0.083307177,0.043501087,0.035310189,0.751976606,0.656641797,0.879517951,0,0.841302556,0.388369286,music,0.985714286
54369,ray noble,love is the sweetest thing,1951,jazz,sweetest thing music sweetest thing earth bring happiness rything story strangest thing song bird wing shall hearts sweetly sing story heart desire fate send tale tire song greatest thing oldest latest thing fate bring story,35,0.001949318,0.107885451,0.001949318,0.001949318,0.001949318,0.001949318,0.001949318,0.249414309,0.001949318,0.359196844,0.001949318,0.073200562,0.112334293,0.001949318,0.072627409,0.001949318,0.284089678,0.65656488,0.968875471,0,0.322959604,0.309287738,music,0.985714286
54370,stan kenton,yesterdays,1951,jazz,arm away arm thrill carres yesterday hungry heart hour gladness know past moment madness hold fast blind charm stardust arm goodbye,21,0.003095975,0.003095976,0.198401445,0.003095975,0.003095975,0.003095975,0.504346466,0.003095976,0.003095975,0.003095975,0.003095975,0.003095975,0.061919505,0.003095975,0.188892954,0.003095975,0.432470486,0.41658334,0.919678634,0.016295547,0.551731245,0.294272254,romantic,0.985714286
54380,dean martin,solitaire,1951,jazz,go spend lonely night deal card leave right queen hearts remind play solitaire game mean heart lose shuffle play solitaire romance element gamble lose play play game rule fool joker laugh play hand carelessly want share feel deal time away solitaire want share feel deal time away solitaire,48,0.001315789,0.00131579,0.00131579,0.103375785,0.001315789,0.001315789,0.034252665,0.00131579,0.295205786,0.00131579,0.00131579,0.00131579,0.00131579,0.020555239,0.430009206,0.049191123,0.277591249,0.489603364,0.963855385,0.005465587,0.295136026,0.114086446,sadness,0.985714286
54382,doris day,moonlight bay,1951,jazz,sail moonlight hear voice ring steal heart sing sweet song moonlight sail moonlight hear voice ring steal heart sing sweet song moonlight sail moonlight hear voice ring steal heart steal heart sing sweet song moonlight sail moonlight moonlight,38,0.001349528,0.001349528,0.001349528,0.001349528,0.001349528,0.001349528,0.001349528,0.001349528,0.001349528,0.455438729,0.001349528,0.315081175,0.001349528,0.001349528,0.207887653,0.001349528,0.314415683,0.500115376,0.986947778,0.000600202,0.276586974,0.0444146,music,0.985714286
54384,dean martin,if,1951,jazz,slave slave rule night star moon bright turn life world bow humbly plead friends crowd turn need rule earth life hadn right world bow humbly plead friends crowd turn need rule earth life hadn right,35,0.002024292,0.002024292,0.39100289,0.088452736,0.069328304,0.002024291,0.002024292,0.002024292,0.002024292,0.002024292,0.002024292,0.360965943,0.061910047,0.002024292,0.002024292,0.002024292,0.198527023,0.537881701,0.960843334,0.875506073,0.126133553,0.196171092,world/life,0.985714286
54385,thelonious monk,monk's mood,1951,jazz,blue blue till mood indigo feelin go stealin shoe sigh long blue mood indigo baby say goodbye evenin light lonely cause care poor fool bluer blue mood indigo blue blue till mood indigo feelin go stealin shoe sigh long blue,40,0.050398171,0.001814882,0.001814882,0.001814882,0.001814882,0.046152066,0.180122685,0.001814882,0.001814882,0.454803783,0.001814882,0.041639947,0.001814882,0.001814882,0.067673241,0.137431522,0.375067692,0.586493347,0.926706754,0.818825911,0.14983512,0.239215479,music,0.985714286
54389,the andrews sisters,winter wonderland,1951,jazz,sleigh bell ring listen snow glisten beautiful sight tonight walk winter wonderland go away bluebird stay sing song walk winter wonderland meadow build snowman pretend parson marry later conspire dream face unafraid plan walk winter wonderland meadow build snowman pretend circus clown lot mister snowman kid knock snow thrill nose get chill frolic play eskimo walk winter wonderland walk winter wonderland walk winter wonderland,64,0.001349528,0.001349528,0.001349528,0.045674182,0.001349528,0.001349528,0.031728282,0.001349528,0.001349528,0.375005417,0.239889173,0.001349528,0.001349528,0.03364368,0.256515406,0.001349528,0.770388823,0.555162423,0.798192568,0,0.706306678,0.218193801,music,0.985714286
