,artist_name,track_name,release_date,genre,lyrics,len,dating,violence,world/life,night/time,shake the audience,family/gospel,romantic,communication,obscene,music,movement/places,light/visual perceptions,family/spiritual,like/girls,sadness,feelings,danceability,loudness,acousticness,instrumentalness,valence,energy,topic,age
54700,erroll garner,september song,1955,jazz,long long december days grow short reach september autumn weather turn leave flame hasn time wait game days dwindle precious september november precious days spend precious days spend,28,0.002770083,0.002770083,0.581605982,0.263495415,0.002770083,0.002770083,0.002770083,0.002770083,0.002770083,0.002770083,0.002770083,0.110577273,0.002770083,0.002770083,0.002770083,0.002770083,0.414058269,0.404481707,0.954819232,0.892712551,0.434253916,0.150123607,world/life,0.928571429
54701,louis armstrong,all of me,1955,jazz,baby good arm lips want lose goodbye leave eye dear take heart good lips lose arm goodbye leave eye dear take heart baby,23,0.089282801,0.002192982,0.002192982,0.002192982,0.002192982,0.002192982,0.409857946,0.002192982,0.002192982,0.002192982,0.002192983,0.002192983,0.002192982,0.002192982,0.301853818,0.085622487,0.344741687,0.625182678,0.739959578,0.00012753,0.681574608,0.714705805,romantic,0.928571429
54705,doris day,it all depends on you,1955,jazz,good depend lonely crowd humble proud depend save money spend right livin blame beggar thing depend,16,0.004385965,0.004385965,0.004385966,0.004385966,0.004385965,0.004385965,0.004385965,0.004385965,0.420074491,0.004385965,0.253888213,0.004385965,0.004385965,0.004385965,0.185065082,0.075182738,0.408642911,0.163192575,0.973895556,0,0.263190437,0.003812732,obscene,0.928571429
54706,tony bennett,i can't believe that you're in love with me,1955,jazz,eye blue kiss know believe tell know mind place believe place imagine say think believe place imagine say think believe believe believe,22,0.002506266,0.002506266,0.303024386,0.002506266,0.002506266,0.002506266,0.061325662,0.544130378,0.002506266,0.053925589,0.002506266,0.002506266,0.002506266,0.002506266,0.002506266,0.002506266,0.473627207,0.560315873,0.862449661,0.000346154,0.804204452,0.270247479,world/life,0.928571429
54709,june christy,this time the dreams on me,1955,jazz,someday close time dream hand look adoringly things stand time dream certain know supply shoulder till want true time dream true time dream certain know supply shoulder till want true time dream,32,0.001879699,0.001879699,0.001879699,0.183138143,0.001879699,0.001879699,0.442338519,0.194230943,0.001879699,0.001879699,0.001879699,0.001879699,0.001879699,0.0018797,0.001879699,0.001879699,0.458464204,0.750378176,0.784136329,0,0.606347898,0.267244382,romantic,0.928571429
54710,tony bennett,i fall in love too easily,1955,jazz,leave wish rite game fall easily fall fast fall terribly hard heart wellschooled cause burn past fall easily fall fast,20,0.003289474,0.003289474,0.003289474,0.003289474,0.003289474,0.003289474,0.003289474,0.003289474,0.003289474,0.003289474,0.003289474,0.003289474,0.003289474,0.003289474,0.84101457,0.003289474,0.333910972,0.503115145,0.986947778,0.005050607,0.096248969,0.131103994,sadness,0.928571429
54711,doris day,mean to me,1955,jazz,prove kiss cross heart promise thrill true dear solemn little mean fair everyway true helpless touch feel feel felt darling forever gentle heart promise apart night years pass away true,30,0.001949318,0.001949318,0.240771686,0.001949318,0.001949318,0.046797062,0.475077245,0.001949318,0.001949318,0.001949318,0.001949318,0.001949318,0.001949318,0.001949318,0.137305509,0.07275805,0.26459439,0.397430967,0.919678634,1.09E-05,0.220939819,0.013983219,romantic,0.928571429
54713,judy garland,after you've gone,1955,jazz,go leave cryin go denyin feel blue feel miss dearest come time forget come time regret someday grow lonely heart break like want go go away go leave cryin go denyin gonna feel blue gonna feel gonna feel miss miss miss bestest come time forget come time regret baby think doin gonna haunt gonna taunt gonna drive ruin go go away,61,0.10150538,0.000993049,0.000993049,0.076388938,0.000993049,0.000993049,0.000993049,0.000993049,0.026718413,0.047953624,0.000993049,0.000993049,0.000993049,0.000993049,0.279730137,0.318515266,0.345824759,0.72073943,0.779116244,3.43E-06,0.483718054,0.400381674,feelings,0.928571429
54715,eartha kitt,do you remember,1955,jazz,hear sighin sayin stay creep dream beach sit huggin squeezin kissin creep dream dream sleep night babaa feel moments ecstasy sleep night babaa wonder creep dream sleep fantasy amaze guess stayin creep dream dream sleep night babaa feel moments ecstasy sleep night babaa wonder creep dream sleep fantasy amaze guess stayin creep dream dream,54,0.001754386,0.001754386,0.001754386,0.3699887,0.001754386,0.001754386,0.001754386,0.186962372,0.039732062,0.001754386,0.001754386,0.001754386,0.001754386,0.001754386,0.001754386,0.040698227,0.294920394,0.565033459,0.93473889,0.002459514,0.180750206,0.254230963,night/time,0.928571429
54718,anita o'day,fine and dandy,1955,jazz,tear game golf play caddy follow heart belong daddy good scout invite dine fine finnan haddie ask heart belong daddy heart belong daddy simply heart belong daddy daddy daddy feel romantic laddie warn right start heart belong daddy daddy belong heart heart belong daddy cause heart belong daddy heart belong daddy simply heart belong daddy daddy daddy feel romantic laddie warn right start heart belong daddy daddy daddy daddy belong heart,71,0.000892061,0.000892061,0.000892061,0.047820139,0.000892061,0.32092511,0.000892061,0.000892061,0.000892061,0.000892061,0.000892061,0.000892061,0.000892061,0.000892061,0.586035211,0.03183863,0.525614643,0.458503192,0.872489832,2.19E-05,0.558944765,0.206181414,sadness,0.928571429
54722,sarah vaughan,sometimes i'm happy,1955,jazz,blue disposition depend mind rain eye hate hate cause blue disposition depend mind rain eye hate hate cause,18,0.003508772,0.473085819,0.003508772,0.109086084,0.003508772,0.003508772,0.003508772,0.003508772,0.003508772,0.139210984,0.003508772,0.003508772,0.003508772,0.003508772,0.003508772,0.003508772,0.386981479,0.631848832,0.647590008,0,0.825845012,0.344323867,violence,0.928571429
54724,tony bennett,give me the simple life,1955,jazz,believe frettin grievin mess strife step strut simple life pleasant din pheasant things roll knife serve tomatoes mash potatoes simple life cottage small spacious wide house ring laughter ones inside like high road like road free care strife sound seedy indeedy simple life,43,0.002024292,0.002024292,0.462653894,0.002024292,0.002024292,0.002024292,0.002024292,0.002024292,0.002024292,0.051273532,0.311267249,0.002024292,0.055250181,0.091215062,0.002024292,0.002024292,0.553774504,0.544547855,0.922690685,0.001184211,0.440436933,0.231207221,world/life,0.928571429
54725,louis armstrong,(what did i do to be so) black and blue,1955,jazz,spring hard lead feel like wish dead black blue mouse house laugh scorn black blue white inside help cause hide face friend skin black blue,25,0.002192982,0.561391678,0.002192983,0.002192982,0.002192982,0.002192983,0.002192982,0.1596079,0.002192983,0.203808223,0.002192983,0.002192983,0.002192982,0.002192983,0.002192983,0.042297461,0.399978339,0.62731072,0.673694452,0.000137652,0.220939819,0.185159737,violence,0.928571429
54727,helen merrill,i'm afraid the masquerade is over,1955,jazz,blue horizon turn dream drift away eye shine like shine thrill go lips meet afraid masquerade word mean mean inspire routine afraid masquerade guess play pagliacci clown disguise learn laugh like pagliacci tear eye look heart say afraid masquerade guess play pagliacci clown disguise learn laugh like pagliacci tear eye look heart say afraid masquerade,55,0.001283697,0.001283697,0.001283697,0.001283697,0.001283697,0.001283697,0.059677872,0.190858017,0.001283697,0.06816624,0.001283697,0.14095354,0.001283697,0.112530181,0.411126089,0.001283697,0.099967508,0.422198292,0.972891539,0.220647773,0.12510305,0.142115349,sadness,0.928571429
54728,helen merrill,beautiful love,1955,jazz,beautiful mystery beautiful content till come thrill song beautiful ruin paradise search dream realize reach heaven depend beautiful dream come true reach heaven depend beautiful dream come true,28,0.113971468,0.00228833,0.00228833,0.00228833,0.00228833,0.00228833,0.34653956,0.00228833,0.00228833,0.050349304,0.00228833,0.236601074,0.00228833,0.22050198,0.00228833,0.00228833,0.09455215,0.582185986,0.7118471,0.000275304,0.144682605,0.273250576,romantic,0.928571429
54730,peggy lee,sing a rainbow,1955,jazz,world string sit rainbow string finger world life song sing rain anytime finger life beautiful thing long hold string silly soandso world string sit rainbow string finger world life,29,0.002105263,0.002105263,0.290765546,0.002105263,0.002105263,0.002105263,0.094910418,0.002105263,0.002105263,0.42967434,0.002105263,0.002105263,0.002105263,0.153070748,0.002105263,0.002105263,0.26459439,0.559623619,0.593373086,0.000717611,0.136438582,0.165139091,music,0.928571429
54736,sarah vaughan,soon,1955,jazz,soon flame soon goodnight goodbye go life go tune time bring change heart start come stay soon come stay soon,20,0.002631579,0.002631579,0.208086923,0.002631579,0.002631579,0.002631579,0.055062826,0.002631579,0.002631579,0.443032725,0.002631579,0.002631579,0.002631579,0.002631579,0.25434384,0.002631579,0.436802773,0.640181524,0.8353412,0,0.248763397,0.241217544,music,0.928571429
54737,the dave brubeck quartet,someday my prince will come,1955,jazz,wait long simply help thrill forever come thrill moment dream come whisper steal kiss away dream come true know moment meet heart start skip beat things long away dream come true,31,0.138853322,0.001754386,0.081998276,0.086438443,0.001754386,0.001754386,0.354141218,0.001754386,0.001754386,0.001754386,0.001754386,0.001754386,0.001754386,0.001754386,0.25206387,0.001754386,0.677244666,0.545522139,0.891566156,0.349190283,0.597073372,0.377357931,romantic,0.928571429
54738,louis armstrong,ramona,1955,jazz,hear mission bell ring song press caress bless teach care remember ramble wear hair hear meet waterfall dread awake go need hear meet waterfall dread awake go need,28,0.002631579,0.002631579,0.213336749,0.002631579,0.093413028,0.002631579,0.002631579,0.002631579,0.002631579,0.338679474,0.188476212,0.12925243,0.002631579,0.002631579,0.002631579,0.002631579,0.527780786,0.637771453,0.909638463,0.000628543,0.565127782,0.312290834,music,0.928571429
54739,louis armstrong,sweet savannah sue,1955,jazz,sweet savannah heart cling sweet savannah adingalinging sing know think star shinin bright blinkin moon tonight winkin lover right know think walk hunkydory kiss nothin tell know true savannah grander time amean sweet savannah,34,0.00228833,0.00228833,0.00228833,0.119232814,0.00228833,0.00228833,0.307651877,0.297824676,0.050461621,0.048312827,0.00228833,0.1467679,0.00228833,0.00228833,0.00228833,0.00228833,0.539694574,0.577314566,0.962851368,0.007135628,0.613561418,0.300278447,romantic,0.928571429
54741,louis armstrong,blue turning grey over you,1955,jazz,miss tender kiss wonderful things hand silvery strand blue turn grey sweet baby novelty thrill view leave blue turn grey,20,0.093474072,0.003759399,0.003759399,0.003759399,0.003759398,0.003759399,0.353819625,0.003759399,0.003759399,0.217904929,0.003759399,0.278410394,0.003759399,0.003759399,0.003759399,0.003759399,0.528863858,0.622952081,0.899598293,0.001791498,0.259068425,0.16013393,romantic,0.928571429
54742,eartha kitt,the day that the circus left town,1955,jazz,wave golden baton wave rain fall wave till music go circus leave heart recall mind heart know frown heart break leave circus leave ask fee elephants water say turn away turn away away go lions tigers wild away go beautiful clown away go child circus leave ask fee elephants water say turn away turn away away go lions tigers wild away go beautiful clown away go child circus leave,69,0.000956938,0.000956938,0.000956938,0.000956938,0.000956938,0.000956938,0.000956938,0.000956938,0.000956938,0.016220209,0.120036248,0.046112757,0.087815219,0.038774516,0.478176983,0.104266485,0.498537853,0.6484373,0.829317098,3.48E-05,0.291014015,0.282259866,sadness,0.928571429
54745,cal tjader,my one and only love,1955,jazz,yeah check want like want things yeah want want tell eye truth lie time produce tribe right right yeah right right like favorite song felt vibe like ayers kill vibes like catch relaxin tjader right bring heat like braxton homie ask music feel like hypnotical hump thump kick wish time things want say cool number check fall doubt crawl remember feel start count aone ready bounce comin realest state like buyin house style cake caseloads pocket swole canseco like naked crowd grabbin leave need guard play push forward center game play care movin like stairs pair gun shootin flare rescue things stress groove guess want check want trust different department store thousand dollar cars bar like want fall like fell heaven arm guess little extras charge card disconnect wanna brawl broads forget city spend money dinners countries know hubbies home laugh phone goin cause go song write know reason cause want want want want want,155,0.000469925,0.018874781,0.000469925,0.023550753,0.036439476,0.011338229,0.000469925,0.192607033,0.377471556,0.069132638,0.000469925,0.013651195,0.000469925,0.058035625,0.070984856,0.000469925,0.520199285,0.352639541,0.988955812,0.922064777,0.382728772,0.05432482,obscene,0.928571429
54746,donald byrd,doug's blues,1955,jazz,drename nigga thats like make movies nigga want smoke tell niggas shooters deep yeah right yall niggas bout life shoot shoot twice cook like nigga make street shoot dice niggas talk cause spray role fold nigga wish sell soul pull taurues sing look chinese lingling years grammy clutchin heat miami fuck fuck granny yall soft sweet like bitch savage blue yellow like nigga dandy water hoe dont fuck nose body freeze hoe stay strap like know tell send right hell bitch sing like free niggas rot cell real street nigga dont abid pull pant polo draw ddre loose dont ball fuck keshawn bitch go wacked fuck pussy know knat laptop cause bitch right bitch manors keshawn nigga break break nigga lick want thug nigga thug play pubg free niggas sell drug nigga play nigga diexguess tell twice time twice trump try shut border yeah white house kill quarter hoe fine beat meat time yall hoe smell stink round yall guess stink need lysol stink shit probably shit yeah nigga shit cause nigga snitch bust girl nut finish walk limp,179,0.000449843,0.000449843,0.000449843,0.000449843,0.033774068,0.000449843,0.000449843,0.000449843,0.766132196,0.057908524,0.000449843,0.000449843,0.023497945,0.073138342,0.000449843,0.000449843,0.495288639,0.667564034,0.92469872,0.140688259,0.504328112,0.417399222,obscene,0.928571429
54749,sammy davis jr.,birth of the blues,1955,jazz,people long lookin different tune croon rhythm start swingin know blue say blue begin ohhh yeah weheard breeze tree sing weird melodies name start blue jail come whale downhearted frail play blue whippoorwill high take note push horn till wear blue note better believe nurse rehearse give news south land give birth blue,53,0.001349528,0.001349528,0.127098275,0.001349528,0.028240515,0.001349528,0.001349528,0.001349528,0.129397716,0.425419746,0.17642459,0.001349528,0.067586405,0.001349528,0.001349528,0.001349528,0.458464204,0.697536087,0.795180517,0,0.494023083,0.417399222,music,0.928571429
54764,miles davis,bye bye blackbird,1955,jazz,save late torture kiss past mistake time forth find kind hard imagine life girl feel like moments hard come tear fall eye flood water rise knees attempt drown sound escape lungs smell drive put time sink seat wonder exactly go pass kind hard imagine life girl feel like moments hard come tear fall eye flood water rise knees attempt drown sound escape lungs tear fall eye flood water rise knees attempt drown sound escape lungs tear fall eye flood water rise knees attempt drown sound escape lungs,87,0.000773994,0.243803576,0.074358997,0.000773994,0.000773994,0.000773994,0.000773994,0.000773994,0.000773994,0.000773994,0.000773994,0.055433813,0.000773994,0.131198604,0.364649808,0.000773994,0.593848153,0.643796631,0.555220437,4.41E-06,0.346661171,0.317295996,sadness,0.928571429
54767,miles davis,there's no you,1955,jazz,need break noise middle night need break boys want fight need break lonely break play game need break shake hand fake name believe tell time run eye tell doubt need break need break need break pay bill break pay rent money loan dent need break early mornings break alarm break boss wouldn harm temper get shorter mood get bottle genie wish need break need break need clothe need need tell want rent movie list things choose need break need break need doctor want pills need diagnosis cause know time tell need break need break need break hassle break hype need break go fashion overnight need break keep break feel need break traffic need break people tell right wrong want listen know need break need break try learn paint try learn sing try meditate try read ching miss miss thing need break need break need doctor want pills need diagnosis cause know time tell need break need break need break,159,0.000395726,0.000395726,0.000395726,0.015852321,0.260864789,0.000395726,0.000395726,0.180819594,0.031475392,0.010684412,0.072337816,0.000395726,0.015770094,0.000395726,0.348905009,0.023327374,0.638254089,0.513524601,0.838353251,0.023380567,0.23227535,0.181155608,sadness,0.928571429
54769,stan getz,without a song,1955,jazz,restless windstorm jumpy puppet string spring fever know spring starry eye gravely discontent like nightingale song sing spring fever spring wish walk strange street hear word hear meet busy spider spin daydream giddy baby swing see crocus rosebud bluebird wing feel melancholy spring spring,44,0.045884159,0.001949318,0.001949318,0.001949318,0.001949318,0.001949318,0.001949318,0.001949318,0.001949318,0.546272221,0.001949318,0.376654535,0.001949318,0.001949318,0.001949318,0.001949318,0.362070833,0.298874446,0.996987949,0.739878543,0.375515251,0.042913052,music,0.928571429
54770,dizzy gillespie,hot house,1955,jazz,catch pull deere maxed sip aquafina trader brew bottle straight hanes boxers apron live shit buzi track skrr skrr yeah spit facts shots round clique swag halibab chick underdogs cause shit haters sleep like flag feel beat brain like tochnit cruise bredrin turn wonderful things intersession bar like chill drill freestyle level earn shekels stay schedule need kettle water stay time excite drink like mayim gotta drink water cause lebron curry shoot stay high hydrate thatwater yeah fade high drated consent bitch like shiva think real religious time fila shabbat package get deliver get distract tryna fidget spinner hairline recede like water dead omanut work etsy tell logistics need bedsheets bitch toot toot dizzy gillespie stay high hydrate water yeah fade high drated high right drated,126,0.000848896,0.023099484,0.035628043,0.079060458,0.079010858,0.000848896,0.000848896,0.000848897,0.675725003,0.000848896,0.000848896,0.000848897,0.000848896,0.000848896,0.000848896,0.000848897,0.558106791,0.547727098,0.996987949,0.927125506,0.688788129,0.269246447,obscene,0.928571429
54771,carmen mcrae,you took advantage of me,1955,jazz,sentimental try fall kill cause take advantage like apple bough gonna shake cook cause take advantage bother know elbow suffer awful time worse near bridge burn babe arm concern lock doors cause take advantage kill cause take advantage tell cook cause take advantge bother know elbow suffer awful time worse near bridge burn babe arm concern lock doors take advantage poor little,62,0.061882807,0.117900335,0.001385042,0.001385042,0.001385042,0.053311321,0.057638244,0.224703915,0.001385042,0.001385042,0.001385042,0.067138482,0.031936351,0.001385042,0.336297335,0.001385042,0.729232102,0.587108684,0.780120261,0,0.443528442,0.209184511,sadness,0.928571429
54772,anita o'day,honeysuckle rose,1955,jazz,listen plea honeybee fill jealousy blame goodness know suckle passin flower droop sigh know reason sweety goodness know suckle sugar touch need sugar sweet stir take sip dainty lips fairly drip confection goodness know suckle honeybee fill jealousy blame goodness know suckle passin flower droop sigh know reason sweety goodness know suckle sugar touch need sugar sweet stir take sip dainty lips fairly drip confection goodness know suckle,68,0.001547988,0.001547988,0.001547988,0.001547988,0.001547988,0.001547988,0.398869346,0.454455607,0.001547988,0.001547988,0.001547988,0.001547988,0.001547988,0.001547988,0.001547988,0.001547988,0.549442218,0.503038228,0.757027869,0,0.443528442,0.114086446,romantic,0.928571429
54775,louis armstrong,honeysuckle rose,1955,jazz,honeybee fill jealousy blame themgoodness know honeysuckle passin byflowers drop sigh know reason sweetergoodness know honeysuckle sugaryou touch sugarit sweet stir take sipsfrom tasty lips fairly drip know honeysuckle instrumental break sugaryou touch sugarit sweet stir take sipsfrom tasty lips fairly drip know honeysuckle say know honeysuckle,47,0.002392345,0.002392345,0.002392345,0.002392345,0.002392345,0.002392345,0.386438472,0.387946107,0.055612943,0.002392345,0.002392345,0.002392345,0.002392345,0.002392345,0.13411731,0.002392345,0.499620925,0.646078507,0.557228471,2.85E-05,0.708367683,0.358338318,romantic,0.928571429
54777,eartha kitt,strangers in the starlight,1955,jazz,strangers starlight hearts pass night whisper leave whisper hold tight kiss thrill moment bear strangers starlight lovers strangers starlight hearts pass night whisper leave whisper hold tight kiss thrill moment bear strangers starlight lovers,34,0.001949318,0.001949318,0.001949318,0.001949318,0.001949318,0.001949318,0.700088427,0.001949318,0.001949318,0.001949318,0.001949318,0.001949318,0.102171256,0.001949318,0.166551232,0.001949318,0.4281382,0.611619619,0.824297012,0.00062247,0.434253916,0.214189672,romantic,0.928571429
54780,helen merrill,anything goes,1955,jazz,olden days glimpse stock look shock heaven know go good author know better word letter word write prose go world go today good today black white today night today guy today women prize today silly great romancer know bind answer propose go world go today good today black white today night today guy today women prize today silly great romancer know bind answer propose go go go wanna alright baby,70,0.021437906,0.092833827,0.37932476,0.035060201,0.000956938,0.000956938,0.000956938,0.05561243,0.000956938,0.024392698,0.062261232,0.000956938,0.066140618,0.022923907,0.000956938,0.21302273,0.35340626,0.483347435,0.932730856,0.013967611,0.510511129,0.156129801,world/life,0.928571429
54781,dave brubeck,somewhere,1955,jazz,place prayer dream feel like give cause fear crash close eye hand yeah kings queen believe write star shine world belong strong exactly place place water meet heart free come life break hand wait kings queen believe write star shine world belong strong exactly place place hold hold place kings queen believe write star shine world belong strong exactly exactly place,61,0.000974659,0.000974659,0.319807784,0.000974659,0.020245347,0.000974659,0.076548218,0.000974659,0.000974659,0.073245955,0.000974659,0.255195622,0.029450998,0.08842198,0.126362848,0.000974659,0.525614643,0.433966618,0.945783078,0.439271255,0.276586974,0.13811122,world/life,0.928571429
54785,thelonious monk,solitude,1955,jazz,solitude haunt dreadful ease days go solitude taunt memories chair fill despair gloom stare know soon solitude afraid dear lord send chair fill despair onecould gloom stare know soon solitude afraid dear lord send,34,0.002506266,0.002506266,0.002506266,0.002506266,0.002506266,0.115388416,0.101925669,0.002506266,0.002506266,0.327439269,0.002506266,0.002506266,0.002506266,0.002506266,0.417652659,0.002506266,0.415141341,0.388098351,0.998995983,0.971659919,0.233305853,0.085557026,sadness,0.928571429
54786,sarah vaughan,i cried for you,1955,jazz,cry turn road turn thing learn cry fool eye little bluer arm little truer cry turn cry turn road turn thing learn cry fool eye little bluer arm little truer cry turn,32,0.001814882,0.001814882,0.001814882,0.001814882,0.001814882,0.21970673,0.001814882,0.001814882,0.001814882,0.001814882,0.097230798,0.182850597,0.001814882,0.001814882,0.472988643,0.001814882,0.410809054,0.656718714,0.973895556,0,0.450741962,0.202177285,sadness,0.928571429
54791,thelonious monk,it don't mean a thing (if it ain't got that swing),1955,jazz,good good music possessin sweet music make tune complete mean thing swing mean thing sing make difference sweet rhythm rything mean thing swing,23,0.002631579,0.002631579,0.002631579,0.002631579,0.002631579,0.002631579,0.002631579,0.310585229,0.002631579,0.464860854,0.002631579,0.002631579,0.002631579,0.002631579,0.002631579,0.131041584,0.607928084,0.421275287,0.957831283,0.934210526,0.549670239,0.149122575,music,0.928571429
54792,the four freshmen,it's a blue world,1955,jazz,blue world world days nights fill heaven away grow blue world world heart indigo blue blue world,17,0.003095975,0.003095975,0.557634292,0.003095975,0.003095975,0.003095975,0.003095975,0.003095975,0.003095975,0.276389049,0.003095975,0.003095976,0.003095976,0.003095975,0.116441054,0.003095975,0.337160186,0.566494885,0.961847351,3.96E-06,0.109645507,0.043513671,world/life,0.928571429
